dialect_id,dialect_name,sentence_id,meaning,othography,english,ipa_no_tone,ipa_with_tone,ipa_converted_no_tone,ipa_converted_with_tone
CD,Chengdu,1,谁啊?我是老三。,哪个?我是老三。,,na ko ŋo sɿ nau san,na53 ko13 ŋo53 sɿ13 nau53 san55,nakoŋosɹ̩nausan,na53ko13ŋo53sɹ̩13nau53san55
CD,Chengdu,2,老四呢?她正跟一个朋友说着话呢。,老四呢?她正在跟一个朋友说倒话的。,,nau sɿ nan tˈa tsən tsai kən i ko pˈoŋ iəu so xua ni,nau53 sɿ13 nan55 tˈa55 tsən13 tsai13 kən55 i31 ko13 pˈoŋ31 iəu53 so31 xua13 ni55,nausɹ̩nantʰat͡sənt͡saikənikopʰoŋiəusoxuani,nau53sɹ̩13nan55tʰa55t͡sən13t͡sai13kən55i31ko13pʰoŋ31iəu53so31xua13ni55
CD,Chengdu,3,她还没说完吗?,她还没有说完呵?,,tˈa xai mei iəu so uan a,tˈa55 xai31 mei13 iəu5355 so31 uan31 a53,tʰaxaimeiiəusouana,tʰa55xai31mei13iəu5355so31uan31a53
CD,Chengdu,4,还没有。大概再有一会儿就说完了。,还没有。大约还有一下儿就说完了。,,xai mei iəu ta yo xai iəu i xər tɕiəu so uanno,xai31 mei13 iəu5355 ta13 yo31 xai31 iəu53 i31 xər55 tɕiəu13 so31 uan31no53,xaimeiiəutayoxaiiəuixərt͡ɕiəusouanno,xai31mei13iəu5355ta13yo31xai31iəu53i31xər55t͡ɕiəu13so31uan31no53
CD,Chengdu,5,他说马上就走，怎么这半天了还在家里?,他讲马上就走，咋个这门久了还在屋头呢?,,tˈa tɕiaŋ ma saŋ tɕiəu tsəu tsa ko tse mən tɕiəu no xai tsai u tˈəu ne,tˈa55 tɕiaŋ53 ma53 saŋ13 tɕiəu13 tsəu53 tsa31 ko13 tse13 mən3155 tɕiəu53 no53 xai31 tsai13 u31 tˈəu3155 ne55,tʰat͡ɕiaŋmasaŋt͡ɕiəut͡səut͡sakot͡semənt͡ɕiəunoxait͡saiutʰəune,tʰa55t͡ɕiaŋ53ma53saŋ13t͡ɕiəu13t͡səu53t͡sa31ko13t͡se13mən3155t͡ɕiəu53no53xai31t͡sai13u31tʰəu3155ne55
CD,Chengdu,6,你到哪儿去?我到城里去。,你走哪儿去?我到城后头去。,,ȵi tsəu nər tɕˈie ŋo tau tsˈən xəu tˈəu tɕˈie,ȵi53 tsəu53 nər53 tɕˈie13 ŋo53 tau13 tsˈən31 xəu1353 tˈəu31 tɕˈie,ɲit͡səunərt͡ɕʰieŋotaut͡sʰənxəutʰəut͡ɕʰie,ɲi53t͡səu53nər53t͡ɕʰie13ŋo53tau13t͡sʰən31xəu1353tʰəu31t͡ɕʰie
CD,Chengdu,7,在那儿，不在这儿。,在那儿，不在这儿。,,tsai nər pu tsai tsər,tsai13 nər55 pu31 tsai13 tsər55,t͡sainərput͡sait͡sər,t͡sai13nər55pu31t͡sai13t͡sər55
CD,Chengdu,8,不是那么做，要这么做。,不是那样子做，要这样子做。,,pu sɿ na iaŋ tsɿ tsu iau tse iaŋ tsɿ tsu,pu31 sɿ13 na13 iaŋ13 tsɿ53 tsu13 iau13 tse13 iaŋ13 tsɿ53 tsu13,pusɹ̩naiaŋt͡sɹ̩t͡suiaut͡seiaŋt͡sɹ̩t͡su,pu31sɹ̩13na13iaŋ13t͡sɹ̩53t͡su13iau13t͡se13iaŋ13t͡sɹ̩53t͡su13
CD,Chengdu,9,太多了，用不着那么多，只要这么多就够了。,太多了，用不倒那门多，只要这门多就够了。,,tˈai to no yoŋ pu tau na mən to tsɿ iau tse mən to tɕiəu kəu no,tˈai13 to55 no53 yoŋ13 pu31 tau53 na13 mən3155 to55 tsɿ53 iau13 tse13 mən3155 to55 tɕiəu13 kəu13 no53,tʰaitonoyoŋputaunaməntot͡sɹ̩iaut͡seməntot͡ɕiəukəuno,tʰai13to55no53yoŋ13pu31tau53na13mən3155to55t͡sɹ̩53iau13t͡se13mən3155to55t͡ɕiəu13kəu13no53
CD,Chengdu,10,这个大，那个小，这两个哪一个好一点呢?,这个大，那个小，这两个哪一个好(一)点儿?,,tse ko ta na ko ɕiau tse niaŋ ko na i ko xau i tiər,tse13 ko1355 ta13 na13 ko1355 ɕiau53 tse13 niaŋ53 ko13 na53 i31 ko13 xau53 i31 tiər53,t͡sekotanakoɕiaut͡seniaŋkonaikoxauitiər,t͡se13ko1355ta13na13ko1355ɕiau53t͡se13niaŋ53ko13na53i31ko13xau53i31tiər53
CD,Chengdu,11,这个比那个好。,这个赶那个好。,,tse ko kan na ko xau,tse13 ko1355 kan53 na13 ko1355 xau53,t͡sekokannakoxau,t͡se13ko1355kan53na13ko1355xau53
CD,Chengdu,12,这些房子不如那些房子好。,这些房子莫得那些房子好。,,tse ɕi faŋ tsɿ mo te na ɕi faŋtsɿ xau,tse13 ɕi55 faŋ31 tsɿ53 mo31 te3155 na13 ɕi55 faŋ31tsɿ53 xau53,t͡seɕifaŋt͡sɹ̩motenaɕifaŋt͡sɹ̩xau,t͡se13ɕi55faŋ31t͡sɹ̩53mo31te3155na13ɕi55faŋ31t͡sɹ̩53xau53
CD,Chengdu,13,他今年多大岁数了?,他今年好大岁数了?,,tˈa tɕin ȵian xau ta suei su no,tˈa55 tɕin55 ȵian31 xau53 ta13 suei13 su13 no53,tʰat͡ɕinɲianxautasueisuno,tʰa55t͡ɕin55ɲian31xau53ta13suei13su13no53
CD,Chengdu,14,大概三十来岁吧。,怕有三十上下了。,,pˈa iəu san sɿ saŋ ɕia no,pˈa13 iəu53 san55 sɿ31 saŋ13 ɕia13 no53,pʰaiəusansɹ̩saŋɕiano,pʰa13iəu53san55sɹ̩31saŋ13ɕia13no53
CD,Chengdu,15,这个东西有多重呢?,这个东西有好重?,,tse ko toŋ ɕi iəu xau tsoŋ,tse13 ko13 toŋ55 ɕi55 iəu53 xau53 tsoŋ13,t͡sekotoŋɕiiəuxaut͡soŋ,t͡se13ko13toŋ55ɕi55iəu53xau53t͡soŋ13
CD,Chengdu,16,有五十斤重呢。,有五十斤重呵。,,iəu u sɿ tɕin tsoŋ o,iəu53 u53 sɿ31 tɕin55 tsoŋ13 o13,iəuusɹ̩t͡ɕint͡soŋo,iəu53u53sɹ̩31t͡ɕin55t͡soŋ13o13
CD,Chengdu,17,拿得动吗?,㧯得起不?,,nau te tɕˈi pu,nau53 te31 tɕˈi53 pu31,nautet͡ɕʰipu,nau53te31t͡ɕʰi53pu31
CD,Chengdu,18,我拿得动，他拿不动。,我㧯得起，他㧯不起。,,ŋo nau te tɕˈi tˈa nau pu tɕˈi,ŋo53 nau53 te31 tɕˈi53 tˈa55 nau53 pu31 tɕˈi53,ŋonautet͡ɕʰitʰanauput͡ɕʰi,ŋo53nau53te31t͡ɕʰi53tʰa55nau53pu31t͡ɕʰi53
CD,Chengdu,19,真不轻，重得连我也拿不动。,硬是不轻呵，重得连我都㧯不起。,,ŋən sɿ pu tɕˈin o tsoŋ te nian ŋo təu nau pu tɕˈi,ŋən13 sɿ13 pu31 tɕˈin55 o13 tsoŋ13 te31 nian31 ŋo53 təu55 nau53 pu31 tɕˈi53,ŋənsɹ̩put͡ɕʰinot͡soŋtenianŋotəunauput͡ɕʰi,ŋən13sɹ̩13pu31t͡ɕʰin55o13t͡soŋ13te31nian31ŋo53təu55nau53pu31t͡ɕʰi53
CD,Chengdu,20,你说得很好，你还会说点什么呢?,你说得好好，你还会说点儿啥子呢?,,ȵi so te xau xau ȵi xai xuei so tiər sa tsɿ ne,ȵi53 so31 te31 xau53 xau53 ȵi53 xai31 xuei13 so31 tiər53 sa13 tsɿ53 ne55,ɲisotexauxauɲixaixueisotiərsat͡sɹ̩ne,ɲi53so31te31xau53xau53ɲi53xai31xuei13so31tiər53sa13t͡sɹ̩53ne55
CD,Chengdu,21,我嘴笨，我说不过他。,我嘴巴笨，我讲不赢他。,,ŋo tsuei pa pən ŋo tɕiaŋ pu in tˈa,ŋo53 tsuei53 pa55 pən13 ŋo53 tɕiaŋ53 pu31 in31 tˈa55,ŋot͡sueipapənŋot͡ɕiaŋpuintʰa,ŋo53t͡suei53pa55pən13ŋo53t͡ɕiaŋ53pu31in31tʰa55
CD,Chengdu,22,说了一遍，又说一遍。,说了一道，又说一道。,,so no i tau iəu so i tau,so31 no53 i31 tau13 iəu13 so31 i31 tau13,sonoitauiəusoitau,so31no53i31tau13iəu13so31i31tau13
CD,Chengdu,23,请你再说一遍。,请你再说一道。,,tɕˈin ȵi tsai so i tau,tɕˈin53 ȵi53 tsai13 so31 i31 tau13,t͡ɕʰinɲit͡saisoitau,t͡ɕʰin53ɲi53t͡sai13so31i31tau13
CD,Chengdu,24,不早了，快去吧。,"不早了,快点去吧",,pu tsau no kˈuai tiər tɕˈie,pu31 tsau53 no53 kˈuai13 tiər53 tɕˈie13,put͡saunokʰuaitiərt͡ɕʰie,pu31t͡sau53no53kʰuai13tiər53t͡ɕʰie13
CD,Chengdu,25,现在还早着呢，等一会儿再去吧。,这阵还早，过一阵再去嘛。,,tse xər xai tsau tən xa xər tsai tɕˈie ma,tse13 xər55 xai31 tsau53 tən53 xa13 xər55 tsai13 tɕˈie13 ma53,t͡sexərxait͡sautənxaxərt͡sait͡ɕʰiema,t͡se13xər55xai31t͡sau53tən53xa13xər55t͡sai13t͡ɕʰie13ma53
CD,Chengdu,26,吃了饭再去好吗?,吃了饭再去要得不?,,tsˈɿ no fan tsai tɕˈie iau te pu,tsˈɿ31 no53 fan13 tsai13 tɕˈie13 iau13 te31 pu31,t͡sʰɹ̩nofant͡sait͡ɕʰieiautepu,t͡sʰɹ̩31no53fan13t͡sai13t͡ɕʰie13iau13te31pu31
CD,Chengdu,27,慢慢儿吃啊，不要着急。,慢慢儿吃，不要慌。,,man mər tsˈɿ pu iau xuaŋ,man13 mər1355 tsˈɿ53 pu31 iau13 xuaŋ55,manmərt͡sʰɹ̩puiauxuaŋ,man13mər1355t͡sʰɹ̩53pu31iau13xuaŋ55
CD,Chengdu,28,坐着吃比站着吃好些。,坐倒起吃比站倒起吃好些。,,tso tau tɕˈi tsˈɿ pi tsan tau tɕˈi tsˈɿxau ɕi,tso13 tau53 tɕˈi53 tsˈɿ31 pi53 tsan13 tau53 tɕˈi53 tsˈɿ31xau53 ɕi55,t͡sotaut͡ɕʰit͡sʰɹ̩pit͡santaut͡ɕʰit͡sʰɹ̩xauɕi,t͡so13tau53t͡ɕʰi53t͡sʰɹ̩31pi53t͡san13tau53t͡ɕʰi53t͡sʰɹ̩31xau53ɕi55
CD,Chengdu,29,他吃了饭了，你吃了饭没有呢?,他吃了饭了，你吃了饭没有?,,tˈa tsˈɿ no fan no ȵi tsˈɿ no fan mei iəu,tˈa55 tsˈɿ31 no53 fan13 no53 ȵi53 tsˈɿ no53 fan13 mei1355 iəu53,tʰat͡sʰɹ̩nofannoɲit͡sʰɹ̩nofanmeiiəu,tʰa55t͡sʰɹ̩31no53fan13no53ɲi53t͡sʰɹ̩no53fan13mei1355iəu53
CD,Chengdu,30,他去过上海，我没有去过。,他去过上海，我没去过。,,tˈa tɕˈie ko saŋ xai ŋo mei tɕˈie ko,tˈa55 tɕˈie13 ko13 saŋ13 xai53 ŋo53 mei1355 tɕˈie13 ko13,tʰat͡ɕʰiekosaŋxaiŋomeit͡ɕʰieko,tʰa55t͡ɕʰie13ko13saŋ13xai53ŋo53mei1355t͡ɕʰie13ko13
CD,Chengdu,31,来闻闻这朵花香不香。,来闻下子这朵花香不香。,,nai uən xa tsɿ tse to xua ɕiaŋ pu ɕiaŋ,nai31 uən31 xa13 tsɿ53 tse13 to53 xua55 ɕiaŋ55 pu31 ɕiaŋ55,naiuənxat͡sɹ̩t͡setoxuaɕiaŋpuɕiaŋ,nai31uən31xa13t͡sɹ̩53t͡se13to53xua55ɕiaŋ55pu31ɕiaŋ55
CD,Chengdu,32,给我一本书。,给我一本书。,,ke ŋo i pən su,ke55 ŋo53 i31 pən53 su55,keŋoipənsu,ke55ŋo53i31pən53su55
CD,Chengdu,33,我真的没有那本书呀。,我硬是莫得那本书。,,ŋo ŋən sɿ mo te na pən su,ŋo53 ŋən13 sɿ13 mo31 te3155 na13 pən53 su55,ŋoŋənsɹ̩motenapənsu,ŋo53ŋən13sɹ̩13mo31te3155na13pən53su55
CD,Chengdu,34,你告诉他。,你跟他说。,,ȵi kən tˈa so,ȵi53 kən55 tˈa55 so31,ɲikəntʰaso,ɲi53kən55tʰa55so31
CD,Chengdu,35,好好地走，不要跑。,好生走，不要跑。,,xau sən tsəu pu iau pˈau,xau53 sən55 tsəu53 pu31 iau13 pˈau53,xausənt͡səupuiaupʰau,xau53sən55t͡səu53pu31iau13pʰau53
CD,Chengdu,36,小心跌下去爬不上来。,小心跘倒了爬不起来。,,ɕiau ɕin pan tau no pˈa pu tɕˈi nai,ɕiau53 ɕin55 pan13 tau53 no53 pˈa31 pu31 tɕˈi53 nai31,ɕiauɕinpantaunopʰaput͡ɕʰinai,ɕiau53ɕin55pan13tau53no53pʰa31pu31t͡ɕʰi53nai31
CD,Chengdu,37,医生叫你多睡睡。,医生喊你多睡下儿。,,i sən xan ȵi to suei xər,i55 sən55 xan53 ȵi53 to55 suei13 xər55,isənxanɲitosueixər,i55sən55xan53ɲi53to55suei13xər55
CD,Chengdu,38,抽烟或者喝茶都不许。,吃烟吃茶都不准。,,tsˈɿ ian tsˈɿ tsˈa təu pu tsuən,tsˈɿ31 ian55 tsˈɿ31 tsˈa31 təu55 pu31 tsuən53,t͡sʰɹ̩iant͡sʰɹ̩t͡sʰatəuput͡suən,t͡sʰɹ̩31ian55t͡sʰɹ̩31t͡sʰa31təu55pu31t͡suən53
CD,Chengdu,39,烟也好，茶也好，我都不喜欢。,烟和茶，我都不喜欢。,,ian xo tsˈa ŋo təu pu ɕi xuan,ian55 xo31 tsˈa31 ŋo53 təu55 pu31 ɕi53 xuan55,ianxot͡sʰaŋotəupuɕixuan,ian55xo31t͡sʰa31ŋo53təu55pu31ɕi53xuan55
CD,Chengdu,40,不管你去不去，反正我是要去的。,不管你去不去，横顺我是要去的。,,pu kuan ȵi tɕˈie pu tɕˈie xuən suən ŋo sɿ iau tɕˈie ni,pu31 kuan53 ȵi53 tɕˈie13 pu31 tɕˈie13 xuən31 suən13 ŋo sɿ13 iau13 tɕˈie13 ni1355,pukuanɲit͡ɕʰieput͡ɕʰiexuənsuənŋosɹ̩iaut͡ɕʰieni,pu31kuan53ɲi53t͡ɕʰie13pu31t͡ɕʰie13xuən31suən13ŋosɹ̩13iau13t͡ɕʰie13ni1355
CD,Chengdu,41,我非去不可。,我就是要去。,,ŋo tɕiəu sɿ iau tɕˈie,ŋo53 tɕiəu13 sɿ13 iau13 tɕˈie13,ŋot͡ɕiəusɹ̩iaut͡ɕʰie,ŋo53t͡ɕiəu13sɹ̩13iau13t͡ɕʰie13
CD,Chengdu,42,你是哪一年来的?,你是哪一年来的?,,ȵi sɿ na i ȵian nai ni,ȵi53 sɿ13 na53 i31 ȵian31 nai31 ni55,ɲisɹ̩naiɲiannaini,ɲi53sɹ̩13na53i31ɲian31nai31ni55
CD,Chengdu,43,我是前年到的北京。,我是前年子到北京的。,,ŋo sɿ tɕˈian ȵian tsɿ tau pe tɕin ni,ŋo53 sɿ13 tɕˈian31 ȵian3155 tsɿ53 tau13 pe31 tɕin55 ni55,ŋosɹ̩t͡ɕʰianɲiant͡sɹ̩taupet͡ɕinni,ŋo53sɹ̩13t͡ɕʰian31ɲian3155t͡sɹ̩53tau13pe31t͡ɕin55ni55
CD,Chengdu,44,今天开会谁的主席?,今天开会哪个当主席?,,tɕˈin tˈian kˈai xuei na ko taŋ tsu ɕi,tɕˈin55 tˈian55 kˈai55 xuei13 na53 ko13 taŋ55 tsu53 ɕi31,t͡ɕʰintʰiankʰaixueinakotaŋt͡suɕi,t͡ɕʰin55tʰian55kʰai55xuei13na53ko13taŋ55t͡su53ɕi31
CD,Chengdu,45,你得请我的客。,请客,,tɕˈin kˈe,tɕˈin53 kˈe31,t͡ɕʰinkʰe,t͡ɕʰin53kʰe31
CD,Chengdu,46,一边走，一边讲。,一边走，一边摆。,,i pian tsəu i pian pai,i31 pian55 tsəu53 i31 pian55 pai53,ipiant͡səuipianpai,i31pian55t͡səu53i31pian55pai53
CD,Chengdu,47,越走越远，越说越多。,越走越远，越摆越多。,,ye tsəu ye yan ye pai ye to,ye31 tsəu53 ye31 yan53 ye31 pai53 ye31 to55,yet͡səuyeyanyepaiyeto,ye31t͡səu53ye31yan53ye31pai53ye31to55
CD,Chengdu,48,把那个东西拿给我。,把那个东西拿给我。,,pa na ko toŋ ɕi na ke ŋo,pa53 na13 ko1355 toŋ55 ɕi55 na31 ke55 ŋo53,panakotoŋɕinakeŋo,pa53na13ko1355toŋ55ɕi55na31ke55ŋo53
CD,Chengdu,49,有些地方把太阳叫日头。,有的地方把太阳叫作日头。,,iəu ni ti faŋ pa tˈai iaŋ tɕiau tso zɿ tˈəu,iəu53 ni55 ti13 faŋ55 pa53 tˈai13 iaŋ tɕiau13 tso31 zɿ31 tˈəu31,iəunitifaŋpatʰaiiaŋt͡ɕiaut͡sozɹ̩tʰəu,iəu53ni55ti13faŋ55pa53tʰai13iaŋt͡ɕiau13t͡so31zɹ̩31tʰəu31
CD,Chengdu,50,您贵姓?我姓王。,你贵姓?我姓王。,,ȵi kuei ɕin ŋo ɕin uaŋ,ȵi53 kuei13 ɕin13 ŋo53 ɕin13 uaŋ31,ɲikueiɕinŋoɕinuaŋ,ɲi53kuei13ɕin13ŋo53ɕin13uaŋ31
CD,Chengdu,51,你姓王我也姓王，咱们两个人都姓王。,你姓王我也姓王，我们两个都姓王。,,ȵi ɕin uaŋ ŋo ie ɕin uaŋ ŋo mən niaŋ ko təu ɕin uaŋ,ȵi53 ɕin13 uaŋ31 ŋo53 ie53 ɕin13 uaŋ31 ŋo53 mən3155 niaŋ53 ko13 təu55 ɕin13 uaŋ,ɲiɕinuaŋŋoieɕinuaŋŋomənniaŋkotəuɕinuaŋ,ɲi53ɕin13uaŋ31ŋo53ie53ɕin13uaŋ31ŋo53mən3155niaŋ53ko13təu55ɕin13uaŋ
CD,Chengdu,52,你先去吧，我们等一会儿再去。,"你先去嘛, 我们等下就来",,ȵi ɕian tɕˈie ma ŋo mən tən xər tɕiəu nai,ȵi53 ɕian55 tɕˈie13 ma53 ŋo53 mən3155 tən53 xər55 tɕiəu13 nai31,ɲiɕiant͡ɕʰiemaŋoməntənxərt͡ɕiəunai,ɲi53ɕian55t͡ɕʰie13ma53ŋo53mən3155tən53xər55t͡ɕiəu13nai31
CD,Chengdu,53,你抽烟不抽?/你抽不抽烟?,你吃不吃烟?,,ȵi tsˈɿ pu tsˈɿ ian,ȵi53 tsˈɿ53 pu31 tsˈɿ53 ian55,ɲit͡sʰɹ̩put͡sʰɹ̩ian,ɲi53t͡sʰɹ̩53pu31t͡sʰɹ̩53ian55
CD,Chengdu,54,你认得那个人不认得?,你认不认得倒那个人?,,ȵi zən pu zən te tau na ko zən,ȵi53 zən13 pu31 zən13 te31 tau53 na13 ko1355 zən31,ɲizənpuzəntetaunakozən,ɲi53zən13pu31zən13te31tau53na13ko1355zən31
