dialect_id,dialect_name,sentence_id,meaning,othography,english,ipa_no_tone,ipa_with_tone,ipa_converted_with_tone,ipa_converted_no_tone
HB,Harbin,1,有一回,有一回,,iou i xuei,iou21321 i xuei24,iou21321 i xuei24,iou i xuei
HB,Harbin,2,北风跟太阳在那儿争论谁的本事大,北风跟太阳在那疙儿掰扯谁的章程大,,pei fəŋ kən tˈai iaŋ tsai nei kar pai tʂˈɤ ʂei ti tʂaŋ tʂˈəŋ ta,pei21321 fəŋ44 kən44 tˈai53 iaŋ tsai53 nei53 kar44 pai44 tʂˈɤ ʂei24 ti tʂaŋ44 tʂˈəŋ ta53,pei21321 fəŋ44 kən44 tʰai53 iaŋ t͡sai53 nei53 kar44 pai44 tʂʰɤ ʂei24 ti tʂaŋ44 tʂʰəŋ ta53,pei fəŋ kən tʰai iaŋ t͡sai nei kar pai tʂʰɤ ʂei ti tʂaŋ tʂʰəŋ ta
HB,Harbin,3,争来争去就是分不出高低来,掰扯来掰扯去就是掰扯不出个高低来,,pai tʂˈɤ lai pai tʂˈɤ tɕˈy tɕiou sʅ pai tʂˈɤ pu tʂˈu kɤ kau ti lai,pai44 tʂˈɤ lai24 pai44 tʂˈɤ tɕˈy53 tɕiou53 sʅ pai44 tʂˈɤ pu tʂˈu44 kɤ kau44 ti44 lai,pai44 tʂʰɤ lai24 pai44 tʂʰɤ t͡ɕʰy53 t͡ɕiou53 sɻ̩ pai44 tʂʰɤ pu tʂʰu44 kɤ kau44 ti44 lai,pai tʂʰɤ lai pai tʂʰɤ t͡ɕʰy t͡ɕiou sɻ̩ pai tʂʰɤ pu tʂʰu kɤ kau ti lai
HB,Harbin,4,这时候路上来了个走道儿的,这时候儿道儿上来了个走道儿的,,tʂɤ ʂʅ xour taur ʂaŋ lai lə kɤ tsou taur ti,tʂɤ53 ʂʅ24 xour taur53 ʂaŋ lai24 lə kɤ tsou21321 taur53 ti,tʂɤ53 ʂɻ̩24 xour taur53 ʂaŋ lai24 lə kɤ t͡sou21321 taur53 ti,tʂɤ ʂɻ̩ xour taur ʂaŋ lai lə kɤ t͡sou taur ti
HB,Harbin,5,他身上穿着件厚大衣,他身上穿着件厚大衣,,tˈa ʂən ʂaŋ tʂˈuan tʂə tɕian xou ta i,tˈa44 ʂən44 ʂaŋ tʂˈuan44 tʂə tɕian xou53 ta53 i44,tʰa44 ʂən44 ʂaŋ tʂʰuan44 tʂə t͡ɕian xou53 ta53 i44,tʰa ʂən ʂaŋ tʂʰuan tʂə t͡ɕian xou ta i
HB,Harbin,6,他们俩就说好了,他么俩就说好了,,tˈa mən lia tɕiou ʂuo xau lə,tˈa44 mən lia213 tɕiou53 ʂuo44 xau213 lə,tʰa44 mən lia213 t͡ɕiou53 ʂuo44 xau213 lə,tʰa mən lia t͡ɕiou ʂuo xau lə
HB,Harbin,7,谁能先叫这个走道儿的脱下他的厚大衣,谁能先叫这个走道儿的脱下他的厚大衣,,ʂei nəŋ ɕian tɕiau tʂei kɤ tsou taur ti tˈuo ɕia tˈa ti xou ta i,ʂei24 nəŋ ɕian44 tɕiau53 tʂei53 kɤ tsou21321 taur53 ti tˈuo44 ɕia tˈa44 ti xou53 ta53 i44,ʂei24 nəŋ ɕian44 t͡ɕiau53 tʂei53 kɤ t͡sou21321 taur53 ti tʰuo44 ɕia tʰa44 ti xou53 ta53 i44,ʂei nəŋ ɕian t͡ɕiau tʂei kɤ t͡sou taur ti tʰuo ɕia tʰa ti xou ta i
HB,Harbin,8,就算谁的本事大,就算谁的章程大,,tɕiou suan ʂei ti tʂaŋ tʂˈəŋ ta,tɕiou53 suan53 ʂei24 ti tʂaŋ44 tʂˈəŋ ta53,t͡ɕiou53 suan53 ʂei24 ti tʂaŋ44 tʂʰəŋ ta53,t͡ɕiou suan ʂei ti tʂaŋ tʂʰəŋ ta
HB,Harbin,9,北风就使劲儿地刮起来了,北风就使劲儿地刮起来了,,pei fəŋ tɕiou ʂʅ tɕiər ti kua tɕˈi lai lə,pei21321 fəŋ44 tɕiou53 ʂʅ21321 tɕiər53 ti kua213 tɕˈi lai lə,pei21321 fəŋ44 t͡ɕiou53 ʂɻ̩21321 t͡ɕiər53 ti kua213 t͡ɕʰi lai lə,pei fəŋ t͡ɕiou ʂɻ̩ t͡ɕiər ti kua t͡ɕʰi lai lə
HB,Harbin,10,不过他越是刮得厉害,不过他越是刮得厉害,,pu kuo tˈa yɛ ʂʅ kua ti li xai,pu24 kuo53 tˈa44 yɛ53 ʂʅ kua213 ti li53 xai,pu24 kuo53 tʰa44 yɛ53 ʂɻ̩ kua213 ti li53 xai,pu kuo tʰa yɛ ʂɻ̩ kua ti li xai
HB,Harbin,11,那个走道儿的把大衣裹得越紧,那个走道儿的把大衣裹得越紧,,nei kɤ tsou taur ti pa ta i kuo ti yɛ tɕin,nei53 kɤ tsou21321 taur53 ti pa213 ta53 i44 kuo213 ti yɛ53 tɕin213,nei53 kɤ t͡sou21321 taur53 ti pa213 ta53 i44 kuo213 ti yɛ53 t͡ɕin213,nei kɤ t͡sou taur ti pa ta i kuo ti yɛ t͡ɕin
HB,Harbin,12,后来北风没法儿了,后尾儿北风没着儿了,,xou yər pei fəŋ mei tʂaur lə,xou53 yər213 pei21321 fəŋ44 mei24 tʂaur44 lə,xou53 yər213 pei21321 fəŋ44 mei24 tʂaur44 lə,xou yər pei fəŋ mei tʂaur lə
HB,Harbin,13,只好就算了,只好就算了,,tʂʅ xau tɕiou suan lə,tʂʅ21324 xau213 tɕiou53 suan53 lə,tʂɻ̩21324 xau213 t͡ɕiou53 suan53 lə,tʂɻ̩ xau t͡ɕiou suan lə
HB,Harbin,14,过了一会儿,过了一会儿,,kuo lə i xuər,kuo53 lə i4453 xuər213,kuo53 lə i4453 xuər213,kuo lə i xuər
HB,Harbin,15,太阳出来了,太阳出来了,,tˈai iaŋ tʂˈu lai lə,tˈai53 iaŋ tʂˈu24 lai lə,tʰai53 iaŋ tʂʰu24 lai lə,tʰai iaŋ tʂʰu lai lə
HB,Harbin,16,他火辣辣地一晒, 他火辣地一晒,,tˈa xuo la ti i ʂai,tˈa44 xuo21321 la44 ti i4424 ʂai53,tʰa44 xuo21321 la44 ti i4424 ʂai53,tʰa xuo la ti i ʂai
HB,Harbin,17,那个走道儿的马上就把那件厚大衣脱下来了,那个走道儿的马上就把那件厚大衣脱下来了,,nei kɤ tsou taur ti ma ʂaŋ tɕiou pa nei tɕian xou ta i tˈip ɕia lai lə,nei53 kɤ tsou21321 taur53 ti ma21321 ʂaŋ53 tɕiou53 pa213 nei53 tɕian53 xou53 ta53 i44 tˈip44 ɕia lai lə,nei53 kɤ t͡sou21321 taur53 ti ma21321 ʂaŋ53 t͡ɕiou53 pa213 nei53 t͡ɕian53 xou53 ta53 i44 tʰip44 ɕia lai lə,nei kɤ t͡sou taur ti ma ʂaŋ t͡ɕiou pa nei t͡ɕian xou ta i tʰip ɕia lai lə
HB,Harbin,18,这下北风只好承认,这下儿北风只好承认,,tʂei ɕiar pei fəŋ tʂʅ xau tʂˈəŋ ʐən,tʂei53 ɕiar53 pei21321 fəŋ44 tʂʅ21324 xau213 tʂˈəŋ24 ʐən53,tʂei53 ɕiar53 pei21321 fəŋ44 tʂɻ̩21324 xau213 tʂʰəŋ24 ʐən53,tʂei ɕiar pei fəŋ tʂɻ̩ xau tʂʰəŋ ʐən
HB,Harbin,19,他们俩当中还是太阳的本事大,他们俩当中还是太阳的章程大,,tˈa mən lia taŋ tʂuŋ xai ʂʅ tˈai iaŋ ti tʂaŋ tʂˈəŋ ta,tˈa44 mən lia213 taŋ44 tʂuŋ44 xai24 ʂʅ tˈai53 iaŋ ti tʂaŋ44 tʂˈəŋ ta53,tʰa44 mən lia213 taŋ44 tʂuŋ44 xai24 ʂɻ̩ tʰai53 iaŋ ti tʂaŋ44 tʂʰəŋ ta53,tʰa mən lia taŋ tʂuŋ xai ʂɻ̩ tʰai iaŋ ti tʂaŋ tʂʰəŋ ta
