dialect_id,dialect_name,sentence_id,meaning,othography,english,ipa_no_tone,ipa_with_tone,ipa_converted_with_tone,ipa_converted_no_tone
LZ,Lanzhou,1,谁啊?我是老三。,谁吵?我是老三,,fei ʂa və ʂʅ lɔ sɛ̃n,fei53 ʂa21 və442 ʂʅ13 lɔ442 sɛ̃n31,fei53ʂa21və442ʂɻ̩13lɔ442sɛ̃n31,feiʂavəʂɻ̩lɔsɛ̃n
LZ,Lanzhou,2,老四呢?她正跟一个朋友说着话呢。,老四崃?她正连一个朋友说话着哩,,lɔ ʂʅ lɛ tˈa tʂə̃n liɛ̃n i kə pə̃n iou fə xua tʂə li,lɔ442 ʂʅ13-11 lɛ53 tˈa31 tʂə̃n13 liɛ̃n53 i13-22 kə13 pə̃n53 iou13 fə13-22 xua13-11 tʂə53 li21,lɔ442ʂɻ̩13-11lɛ53tʰa31tʂə̃n13liɛ̃n53i13-22kə13pə̃n53iou13fə13-22xua13-11tʂə53li21,lɔʂɻ̩lɛtʰatʂə̃nliɛ̃nikəpə̃nioufəxuatʂəli
LZ,Lanzhou,3,她还没说完吗?,她还没说罢吗,,tˈa xɛ̃n m̩ iou fə pa ma,tˈa31 xɛ̃n53 m̩13-11 iou442 fə13-22 pa13-11 ma53,tʰa31xɛ̃n53m̩13-11iou442fə13-22pa13-11ma53,tʰaxɛ̃nm̩ioufəpama
LZ,Lanzhou,4,还没有。大概再有一会儿就说完了。,还没有。哈巴还得一会儿就说完了,,xɛ̃n m̩ iou xa pa xɛ̃n tə i xuei ɯ tɕiou fə vɛ̃n lɔ,xɛ̃n53 m̩13-11 iou442 xa21 pa21 xɛ̃n53 tə13 i13-22 xuei13-11 ɯ21 tɕiou13 fə13-11 vɛ̃n53 lɔ21,xɛ̃n53m̩13-11iou442xa21pa21xɛ̃n53tə13i13-22xuei13-11ɯ21t͡ɕiou13fə13-11vɛ̃n53lɔ21,xɛ̃nm̩iouxapaxɛ̃ntəixueiɯt͡ɕioufəvɛ̃nlɔ
LZ,Lanzhou,5,他说马上就走，怎么这半天了还在家里?,他说马上就走呢，这么半天了怎么还在屋里哩唦?,,tˈa fə ma ʂɑ̃ tɕiou tsou li tʂʅ mə̃n pɛ̃ tˈiɛ̃n lɔ tsə̃n mə xɛ̃n tsɛ vu li li ʂa,tˈa442 fə13 ma442 ʂɑ̃21 tɕiou13-11 tsou442 li21 tʂʅ13-11 mə̃n53 pɛ̃13-11 tˈiɛ̃n31 lɔ21 tsə̃n442 mə21 xɛ̃n53 tsɛ13 vu13-11 li13 li53 ʂa21,tʰa442fə13ma442ʂɑ̃21t͡ɕiou13-11t͡sou442li21tʂɻ̩13-11mə̃n53pɛ̃13-11tʰiɛ̃n31lɔ21t͡sə̃n442mə21xɛ̃n53t͡sɛ13vu13-11li13li53ʂa21,tʰafəmaʂɑ̃t͡ɕiout͡soulitʂɻ̩mə̃npɛ̃tʰiɛ̃nlɔt͡sə̃nməxɛ̃nt͡sɛvuliliʂa
LZ,Lanzhou,6,你到哪儿去?我到城里去。,你哪里去哩?我进城去哩,,ȵi la li tɕˈi li və tɕĩn tʂˈə̃n tɕˈi li,ȵi442 la42 li21 tɕˈi13-11 li53 və442 tɕĩn13-11 tʂˈə̃n53 tɕˈi13-11 li53,ɲi442la42li21t͡ɕʰi13-11li53və442t͡ɕĩn13-11tʂʰə̃n53t͡ɕʰi13-11li53,ɲilalit͡ɕʰilivət͡ɕĩntʂʰə̃nt͡ɕʰili
LZ,Lanzhou,7,在那儿，不在这儿。,在那搭呢，没有在这搭。,,tsɛ lɛ ta li m̩ iou tsɜ tʂʅ ta,tsɛ13 lɛ13-11 ta53 li21 m̩13-11 iou442 tsɜ13 tʂʅ13-11 ta53,t͡sɛ13lɛ13-11ta53li21m̩13-11iou442t͡sɜ13tʂɻ̩13-11ta53,t͡sɛlɛtalim̩iout͡sɜtʂɻ̩ta
LZ,Lanzhou,8,不是那么做，要这么做。,不是那么的个做法，这么做着哩,,pu ʂʅ lɛ mə̃n ti kə tsu fa tʂʅ mə̃n tsu tʂə li,pu13-22 ʂʅ13 lɛ13-11 mə̃n53 ti21 kə21 tsu13-11 fa13 tʂʅ13-11 mə̃n53 tsu13-11 tʂə53 li21,pu13-22ʂɻ̩13lɛ13-11mə̃n53ti21kə21t͡su13-11fa13tʂɻ̩13-11mə̃n53t͡su13-11tʂə53li21,puʂɻ̩lɛmə̃ntikət͡sufatʂɻ̩mə̃nt͡sutʂəli
LZ,Lanzhou,9,太多了，用不着那么多，只要这么多就够了。,太多了，用不上那么些子，这么些就够了。,,tˈɛ tuə lɔ ỹn pu ʂɑ̃ lɛ mə̃n ɕiə tsɿ tsʅ mə̃n ɕiə tɕiou kou lɔ,tˈɛ13-11 tuə31 lɔ21 ỹn13-22 pu13-22 ʂɑ̃13 lɛ13-11 mə̃n53 ɕiə21 tsɿ21 tsʅ13-11 mə̃n53 ɕiə21 tɕiou13 kou13-11 lɔ53,tʰɛ13-11tuə31lɔ21ỹn13-22pu13-22ʂɑ̃13lɛ13-11mə̃n53ɕiə21t͡sɹ̩21t͡sɻ̩13-11mə̃n53ɕiə21t͡ɕiou13kou13-11lɔ53,tʰɛtuəlɔỹnpuʂɑ̃lɛmə̃nɕiət͡sɹ̩t͡sɻ̩mə̃nɕiət͡ɕioukoulɔ
LZ,Lanzhou,10,这个大，那个小，这两个哪一个好一点呢?,这个大，那个尕，这两个哪个好些唦?,,tʂʅ kə ta lɛ kə ka tʂʅ liɑ̃ kə la kə xɔ ɕiə ʂa,tʂʅ13-11 kə53 ta13 lɛ13-11 kə53 ka442 tʂʅ13-11 liɑ̃442 kə21 la442 kə21 xɔ442 ɕiə21 ʂa21,tʂɻ̩13-11kə53ta13lɛ13-11kə53ka442tʂɻ̩13-11liɑ̃442kə21la442kə21xɔ442ɕiə21ʂa21,tʂɻ̩kətalɛkəkatʂɻ̩liɑ̃kəlakəxɔɕiəʂa
LZ,Lanzhou,11,这个比那个好。,这个赶那个好噧。,,tʂʅ kə kɛ̃n lɛ kə xɔ mɛ̃n,tʂʅ13-11 kə53 kɛ̃n442 lɛ13-11 kə53 xɔ442 mɛ̃n21,tʂɻ̩13-11kə53kɛ̃n442lɛ13-11kə53xɔ442mɛ̃n21,tʂɻ̩kəkɛ̃nlɛkəxɔmɛ̃n
LZ,Lanzhou,12,这些房子不如那些房子好。,这些房子没有那些房子好。,,tʂʅ ɕiə fɑ̃ tsɿ m̩ iou lɛ ɕiə fɑ̃ tsɿ xɔ,tʂʅ13-11 ɕiə31 fɑ̃53 tsɿ13 m̩13-11 iou442 lɛ13-11 ɕiə31 fɑ̃53 tsɿ13 xɔ442,tʂɻ̩13-11ɕiə31fɑ̃53t͡sɹ̩13m̩13-11iou442lɛ13-11ɕiə31fɑ̃53t͡sɹ̩13xɔ442,tʂɻ̩ɕiəfɑ̃t͡sɹ̩m̩ioulɛɕiəfɑ̃t͡sɹ̩xɔ
LZ,Lanzhou,13,他今年多大岁数了?,他今年多大了?,,tˈa tɕĩn ȵiɛ̃n tuə ta lɔ,tˈa442 tɕĩn31 ȵiɛ̃n21 tuə31 ta13-11 lɔ53,tʰa442t͡ɕĩn31ɲiɛ̃n21tuə31ta13-11lɔ53,tʰat͡ɕĩnɲiɛ̃ntuətalɔ
LZ,Lanzhou,14,大概三十来岁吧。,大谋儿三十多了。,,ta mu ɯ sɛ̃n ʂʅ tuə lɔ,ta13-11 mu442 ɯ21 sɛ̃n31 ʂʅ13-11 tuə31 lɔ21,ta13-11mu442ɯ21sɛ̃n31ʂɻ̩13-11tuə31lɔ21,tamuɯsɛ̃nʂɻ̩tuəlɔ
LZ,Lanzhou,15,这个东西有多重呢?,这个东西有多重吵?,,tʂʅ kə tũn ɕi iou tuə pfə̃n ʂa,tʂʅ13-11 kə53 tũn31 ɕi21 iou442 tuə31 pfə̃n13-11 ʂa53,tʂɻ̩13-11kə53tũn31ɕi21iou442tuə31pfə̃n13-11ʂa53,tʂɻ̩kətũnɕiioutuəpfə̃nʂa
LZ,Lanzhou,16,有五十斤重呢。,哈巴有五十来斤哩。,,xa pa iou vu ʂʅ lɛ tɕĩn li,xa21 pa21 iou442-53 vu442 ʂʅ21 lɛ53 tɕĩn31 li21,xa21pa21iou442-53vu442ʂɻ̩21lɛ53t͡ɕĩn31li21,xapaiouvuʂɻ̩lɛt͡ɕĩnli
LZ,Lanzhou,17,拿得动吗?,能拿动吗?,,lə̃n la tũn ma,lə̃n53 la53 tũn13-11 ma53,lə̃n53la53tũn13-11ma53,lə̃nlatũnma
LZ,Lanzhou,18,我拿得动，他拿不动。,我能拿动，他拿不动,,və lə̃n la tũn tˈa la pu tũn,və442 lə̃n53 la53 tũn13 tˈa31 la53 pu13-11 tũn13,və442lə̃n53la53tũn13tʰa31la53pu13-11tũn13,vələ̃nlatũntʰalaputũn
LZ,Lanzhou,19,真不轻，重得连我也拿不动。,哦实话不轻呐，连我都拿不动呐,,a ʂʅ xua pu tɕˈĩn la liɛ̃n və tou la pu tũn la,a21 ʂʅ53 xua13 pu13-11 tɕˈĩn31 la21 liɛ̃n53 və442 tou31 la53 pu13-22 tũn13-11 la53,a21ʂɻ̩53xua13pu13-11t͡ɕʰĩn31la21liɛ̃n53və442tou31la53pu13-22tũn13-11la53,aʂɻ̩xuaput͡ɕʰĩnlaliɛ̃nvətoulaputũnla
LZ,Lanzhou,20,你说得很好，你还会说点什么呢?,你说的好哇，你还会说些啥唦,,ȵi fə ti xɔ ua ȵi xɛ̃n xuei fə ɕiə sa ʂa,ȵi442 fə13-11 ti53 xɔ442 ua21 ȵi442 xɛ̃n53 xuei13-22 fə13-11 ɕiə53 sa13-11 ʂa53,ɲi442fə13-11ti53xɔ442ua21ɲi442xɛ̃n53xuei13-22fə13-11ɕiə53sa13-11ʂa53,ɲifətixɔuaɲixɛ̃nxueifəɕiəsaʂa
LZ,Lanzhou,21,我嘴笨，我说不过他。,我的嘴笨的很，我说不过那,,və ti tsuei pə̃n ti xə̃n və fə pu kuə la,və442 ti21 tsuei442 pə̃n13-11 ti53 xə̃n442 və442 fə13-22 pu13-22 kuə13 la53,və442ti21t͡suei442pə̃n13-11ti53xə̃n442və442fə13-22pu13-22kuə13la53,vətit͡sueipə̃ntixə̃nvəfəpukuəla
LZ,Lanzhou,22,说了一遍，又说一遍。,说了一刬，可又说了一刬,,fə lɔ i tʂˈɛ̃n kə iou fə lɔ i tʂˈɛ̃n,fə13-11 lɔ53 i13-22 tʂˈɛ̃n13 kə442-53 iou442 fə13-11 lɔ53 i13-22 tʂˈɛ̃n13,fə13-11lɔ53i13-22tʂʰɛ̃n13kə442-53iou442fə13-11lɔ53i13-22tʂʰɛ̃n13,fəlɔitʂʰɛ̃nkəioufəlɔitʂʰɛ̃n
LZ,Lanzhou,23,请你再说一遍。,嘉请你重说一刬。,,tɕia tɕˈĩn ȵi tsˈũn fə i tʂˈɛ̃n,tɕia21 tɕˈĩn442-53 ȵi442 tsˈũn53 fə13-22 i13-22 tʂˈɛ̃n13,t͡ɕia21t͡ɕʰĩn442-53ɲi442t͡sʰũn53fə13-22i13-22tʂʰɛ̃n13,t͡ɕiat͡ɕʰĩnɲit͡sʰũnfəitʂʰɛ̃n
LZ,Lanzhou,24,不早了，快去吧。,不早了，快些去唦。,,pu tsɔ lɔ kˈuɛ ɕiə tɕˈi ʂa,pu13-11 tsɔ442 lɔ21 kˈuɛ13-11 ɕiə53 tɕˈi13-11 ʂa53,pu13-11t͡sɔ442lɔ21kʰuɛ13-11ɕiə53t͡ɕʰi13-11ʂa53,put͡sɔlɔkʰuɛɕiət͡ɕʰiʂa
LZ,Lanzhou,25,现在还早着呢，等一会儿再去吧。,嘉现在还早着呢，等一下了再去唦,,tɕia xɛ̃n tsɔ tʂə li tə̃n i xa lɔ tsɛ tɕˈi ʂa,tɕia442 xɛ̃n53 tsɔ442 tʂə21 li21 tə̃n442 i21 xa21 lɔ21 tsɛ13-22 tɕˈi13-11 ʂa53,t͡ɕia442xɛ̃n53t͡sɔ442tʂə21li21tə̃n442i21xa21lɔ21t͡sɛ13-22t͡ɕʰi13-11ʂa53,t͡ɕiaxɛ̃nt͡sɔtʂəlitə̃nixalɔt͡sɛt͡ɕʰiʂa
LZ,Lanzhou,26,吃了饭再去好吗?,吃罢饭了再去，中哩不?,,tʂˈʅ pa fɛ̃n lɔ tsɛ tɕˈi pfə̃n li pu,tʂˈʅ13-22 pa13 fɛ̃n13-11 lɔ53 tsɛ13-22 tɕˈi13 pfə̃n31 li21 pu13,tʂʰɻ̩13-22pa13fɛ̃n13-11lɔ53t͡sɛ13-22t͡ɕʰi13pfə̃n31li21pu13,tʂʰɻ̩pafɛ̃nlɔt͡sɛt͡ɕʰipfə̃nlipu
LZ,Lanzhou,27,慢慢儿吃啊，不要着急。,嘉慢些吃吵，不要急。,,tɕia mɛ̃n ɕiə tʂˈʅ ʂa pu lɔ tɕi,tɕia21 mɛ̃n13-11 ɕiə53 tʂˈʅ13-11 ʂa53 pu13-22 lɔ13-11 tɕi53,t͡ɕia21mɛ̃n13-11ɕiə53tʂʰɻ̩13-11ʂa53pu13-22lɔ13-11t͡ɕi53,t͡ɕiamɛ̃nɕiətʂʰɻ̩ʂapulɔt͡ɕi
LZ,Lanzhou,28,坐着吃比站着吃好些。,坐下了吃比站着吃好些儿。,,tsuə xa lɔ tʂˈʅ pi tʂɛ̃n tʂə tʂˈʅ xɔ ɕiə ɯ,tsuə13-11 xa53 lɔ21 tʂˈʅ13 pi442 tʂɛ̃n13-11 tʂə53 tʂˈʅ13 xɔ442 ɕiə21 ɯ21,t͡suə13-11xa53lɔ21tʂʰɻ̩13pi442tʂɛ̃n13-11tʂə53tʂʰɻ̩13xɔ442ɕiə21ɯ21,t͡suəxalɔtʂʰɻ̩pitʂɛ̃ntʂətʂʰɻ̩xɔɕiəɯ
LZ,Lanzhou,29,他吃了饭了，你吃了饭没有呢?,他吃了饭了，你吃了没有,,tˈa tʂˈʅ lɔ fɛ̃n lɔ ȵi tʂˈʅ lɔ m̩ iou,tˈa31 tʂˈʅ13-11 lɔ53 fɛ̃n13-11 lɔ53 ȵi442 tʂˈʅ13-11 lɔ53 m̩13-11 iou442,tʰa31tʂʰɻ̩13-11lɔ53fɛ̃n13-11lɔ53ɲi442tʂʰɻ̩13-11lɔ53m̩13-11iou442,tʰatʂʰɻ̩lɔfɛ̃nlɔɲitʂʰɻ̩lɔm̩iou
LZ,Lanzhou,30,他去过上海，我没有去过。,那走过上海，我没有去过,,la tsou luə ʂɑ̃ xɛ və m̩ iou tɕˈi kuə,la53 tsou442 luə21 ʂɑ̃13-11 xɛ442 və442 m̩13-11 iou442 tɕˈi13-11 kuə53,la53t͡sou442luə21ʂɑ̃13-11xɛ442və442m̩13-11iou442t͡ɕʰi13-11kuə53,lat͡souluəʂɑ̃xɛvəm̩iout͡ɕʰikuə
LZ,Lanzhou,31,来闻闻这朵花香不香。,嘉你闻给下这个花儿香不香。,,tɕia ȵi və̃n kɯ xa tʂʅ kə xua ɯ ɕiɑ̃ pu ɕiɑ̃,tɕia21 ȵi442 və̃n53 kɯ13 xa53 tʂʅ13-11 kə53 xua31 ɯ21 ɕiɑ̃31 pu21 ɕiɑ̃31,t͡ɕia21ɲi442və̃n53kɯ13xa53tʂɻ̩13-11kə53xua31ɯ21ɕiɑ̃31pu21ɕiɑ̃31,t͡ɕiaɲivə̃nkɯxatʂɻ̩kəxuaɯɕiɑ̃puɕiɑ̃
LZ,Lanzhou,32,给我一本书。,给我给一本书。,,kɯ və kɯ i pə̃n fu,kɯ442-53 və442 kɯ442 i13-11 pə̃n442 fu31,kɯ442-53və442kɯ442i13-11pə̃n442fu31,kɯvəkɯipə̃nfu
LZ,Lanzhou,33,我真的没有那本书呀。,我实话没有书。,,və ʂʅ xua m̩ iou fu,və442 ʂʅ53 xua13 m̩13-11 iou442 fu31,və442ʂɻ̩53xua13m̩13-11iou442fu31,vəʂɻ̩xuam̩ioufu
LZ,Lanzhou,34,你告诉他。,你给那说一下。,,ȵi kɯ la fə i xa,ȵi442 kɯ442 la53 fə13-11 i13 xa53,ɲi442kɯ442la53fə13-11i13xa53,ɲikɯlafəixa
LZ,Lanzhou,35,好好地走，不要跑。,嘉好好地走，不要跑了唦。,,tɕia xɔ xɔ ti tsou pu lɔ pˈɔ lɔ ʂa,tɕia21 xɔ442-53 xɔ442 ti21 tsou442 pu13-22 lɔ13-11 pˈɔ442 lɔ21 ʂa21,t͡ɕia21xɔ442-53xɔ442ti21t͡sou442pu13-22lɔ13-11pʰɔ442lɔ21ʂa21,t͡ɕiaxɔxɔtit͡soupulɔpʰɔlɔʂa
LZ,Lanzhou,36,小心跌下去爬不上来。,小心跌下去上不来,,ɕiɔ ɕĩn tiə xa tɕˈi ʂɑ̃ pu lɛ,ɕiɔ442 ɕĩn31 tiə13-22 xa13-11 tɕˈi53 ʂɑ̃13-22 pu13-11 lɛ53,ɕiɔ442ɕĩn31tiə13-22xa13-11t͡ɕʰi53ʂɑ̃13-22pu13-11lɛ53,ɕiɔɕĩntiəxat͡ɕʰiʂɑ̃pulɛ
LZ,Lanzhou,37,医生叫你多睡睡。,医生叫你多睡一会儿哩。,,i ʂə̃n tɕiɔ ȵi tuə fei i ɯ li,i31 ʂə̃n21 tɕiɔ13-11 ȵi442 tuə31 fei13-22 i13-11 ɯ53 li21,i31ʂə̃n21t͡ɕiɔ13-11ɲi442tuə31fei13-22i13-11ɯ53li21,iʂə̃nt͡ɕiɔɲituəfeiiɯli
LZ,Lanzhou,38,抽烟或者喝茶都不许。,抽烟喝茶都不准。,,tʂˈou iɛ̃n xə tʂˈa tou pu pfə̃n,tʂˈou31-33 iɛ̃n31 xə13-11 tʂˈa tou31 pu13-11 pfə̃n442,tʂʰou31-33iɛ̃n31xə13-11tʂʰatou31pu13-11pfə̃n442,tʂʰouiɛ̃nxətʂʰatoupupfə̃n
LZ,Lanzhou,39,烟也好，茶也好，我都不喜欢。,烟也罢，茶也罢，我都不爱,,iɛ̃n iə pa tʂˈa iə pa və tou pu ɛ,iɛ̃n31 iə442 pa13 tʂˈa53 iə442 pa13 və442 tou31 pu13-22 ɛ13,iɛ̃n31iə442pa13tʂʰa53iə442pa13və442tou31pu13-22ɛ13,iɛ̃niəpatʂʰaiəpavətoupuɛ
LZ,Lanzhou,40,不管你去不去，反正我是要去的。,不管你去不去，反正我要去哩,,pu kuɛ̃n ȵi tɕˈi pu tɕˈi fɛ̃n tʂə̃n və iɔ tɕˈi li,pu13-11 kuɛ̃n442 ȵi442 tɕˈi13-11 pu13-22 tɕˈi13 fɛ̃n442 tʂə̃n13 və442 iɔ13-22 tɕˈi13-11 li53,pu13-11kuɛ̃n442ɲi442t͡ɕʰi13-11pu13-22t͡ɕʰi13fɛ̃n442tʂə̃n13və442iɔ13-22t͡ɕʰi13-11li53,pukuɛ̃nɲit͡ɕʰiput͡ɕʰifɛ̃ntʂə̃nvəiɔt͡ɕʰili
LZ,Lanzhou,41,我非去不可。,怎么下了我都要去哩,,tsə̃n mə xa lɔ və tou iɔ tɕˈi li,tsə̃n442 mə21 xa21 lɔ21 və442 tou31 iɔ13-22 tɕˈi13-11 li53,t͡sə̃n442mə21xa21lɔ21və442tou31iɔ13-22t͡ɕʰi13-11li53,t͡sə̃nməxalɔvətouiɔt͡ɕʰili
LZ,Lanzhou,42,你是哪一年来的?,嘉你是哪一年来的唦?,,tɕia ȵi ʂʅ la i ȵiɛ̃n lɛ ti ʂa,tɕia21 ȵi442 ʂʅ13-11 la442 i13-11 ȵiɛ̃n13 lɛ53 ti13 ʂa53,t͡ɕia21ɲi442ʂɻ̩13-11la442i13-11ɲiɛ̃n13lɛ53ti13ʂa53,t͡ɕiaɲiʂɻ̩laiɲiɛ̃nlɛtiʂa
LZ,Lanzhou,43,我是前年到的北京。,我是前年个到北京的。,,və ʂʅ tɕˈiɛ̃n ȵiɛ̃nkə tɔ pə tɕĩn ti,və442 ʂʅ13-11 tɕˈiɛ̃n53 ȵiɛ̃n13kə53 tɔ13 pə13-11 tɕĩn31 ti21,və442ʂɻ̩13-11t͡ɕʰiɛ̃n53ɲiɛ̃n13kə53tɔ13pə13-11t͡ɕĩn31ti21,vəʂɻ̩t͡ɕʰiɛ̃nɲiɛ̃nkətɔpət͡ɕĩnti
LZ,Lanzhou,44,今天开会谁的主席?,今个天开会谁是主席唦?,,tɕĩn kə tˈiɛ̃n kˈɛ xuei fei ʂʅ pfu ɕi ʂa,tɕĩn31 kə21 tˈiɛ̃n31 kˈɛ31 xuei13 fei53 ʂʅ13-11 pfu442 ɕi53 ʂa13,t͡ɕĩn31kə21tʰiɛ̃n31kʰɛ31xuei13fei53ʂɻ̩13-11pfu442ɕi53ʂa13,t͡ɕĩnkətʰiɛ̃nkʰɛxueifeiʂɻ̩pfuɕiʂa
LZ,Lanzhou,45,你得请我的客。,嘉你要把我请一下哩,,tɕia ȵi iɔ pa və tɕˈĩn i xa li,tɕia21 ȵi442 iɔ13 pa442-53 və442 tɕˈĩn442 i21 xa21 li21,t͡ɕia21ɲi442iɔ13pa442-53və442t͡ɕʰĩn442i21xa21li21,t͡ɕiaɲiiɔpavət͡ɕʰĩnixali
LZ,Lanzhou,46,一边走，一边讲。,一面走着哩，一面说着哩,,i miɛ̃n tsou tʂə li i miɛ̃n fə tʂə li,i13-11 miɛ̃n13 tsou442 tʂə21 li21 i13-11 miɛ̃n13 fə13-11 tʂə13 li53,i13-11miɛ̃n13t͡sou442tʂə21li21i13-11miɛ̃n13fə13-11tʂə13li53,imiɛ̃nt͡soutʂəliimiɛ̃nfətʂəli
LZ,Lanzhou,47,越走越远，越说越多。,越走越远了，越说越多了,,yə tsou yə yɛ̃n lɔ yə fə yə tuə lɔ,yə13-11 tsou442 yə13-11 yɛ̃n442 lɔ21 yə13-11 fə13 yə13-11 tuə31 lɔ21,yə13-11t͡sou442yə13-11yɛ̃n442lɔ21yə13-11fə13yə13-11tuə31lɔ21,yət͡souyəyɛ̃nlɔyəfəyətuəlɔ
LZ,Lanzhou,48,把那个东西拿给我。,嘉把那个东西给我取给一下唦,,tɕia pa lɛ kə tũn ɕi kɯ və tɕˈy kɯ i xa ʂa,tɕia21 pa442 lɛ13-11 kə53 tũn31 ɕi21 kɯ442-53 və442 tɕˈy442 kɯ21 i21 xa21 ʂa21,t͡ɕia21pa442lɛ13-11kə53tũn31ɕi21kɯ442-53və442t͡ɕʰy442kɯ21i21xa21ʂa21,t͡ɕiapalɛkətũnɕikɯvət͡ɕʰykɯixaʂa
LZ,Lanzhou,49,有些地方把太阳叫日头。,有些地方把太阳叫日头,,iou ɕiə ti fɑ̃ pa tˈɛ iɑ̃ tɕiɔ ʐʅ tˈou,iou442 ɕiə21 ti13-11 fɑ̃31 pa442 tˈɛ13-11 iɑ̃53 tɕiɔ13-11 ʐʅ13-11 tˈou13,iou442ɕiə21ti13-11fɑ̃31pa442tʰɛ13-11iɑ̃53t͡ɕiɔ13-11ʐɻ̩13-11tʰou13,iouɕiətifɑ̃patʰɛiɑ̃t͡ɕiɔʐɻ̩tʰou
LZ,Lanzhou,50,您贵姓?我姓王。,你姓啥?我姓王,,ȵi ɕin sa və ɕĩn vɑ̃,ȵi442 ɕin13-22 sa13 və442 ɕĩn13-11 vɑ̃53,ɲi442ɕin13-22sa13və442ɕĩn13-11vɑ̃53,ɲiɕinsavəɕĩnvɑ̃
LZ,Lanzhou,51,你姓王我也姓王，咱们两个人都姓王。,你姓王我也姓王，我们两个人都姓王,,ȵi ɕĩn vɑ̃ və iə ɕĩn vɑ̃ və mə̃n liɑ̃ kə ʐə̃n tou ɕĩn vɑ̃,ȵi442 ɕĩn13-11 vɑ̃53 və442-53 iə442 ɕĩn13-11 vɑ̃53 və442 mə̃n21 liɑ̃442 kə21 ʐə̃n53 tou31 ɕĩn13-11 vɑ̃53,ɲi442ɕĩn13-11vɑ̃53və442-53iə442ɕĩn13-11vɑ̃53və442mə̃n21liɑ̃442kə21ʐə̃n53tou31ɕĩn13-11vɑ̃53,ɲiɕĩnvɑ̃vəiəɕĩnvɑ̃vəmə̃nliɑ̃kəʐə̃ntouɕĩnvɑ̃
LZ,Lanzhou,52,你先去吧，我们等一会儿再去。,你先去唦，我们等一下了再去。,,ȵi ɕiɛ̃n tɕˈi ʂa və mə̃n tə̃n i xa lɔ tsɛ tɕˈi,ȵi442 ɕiɛ̃n31 tɕˈi13-11 ʂa53 və442 mə̃n21 tə̃n442 i21 xa21 lɔ21 tsɛ13-22 tɕˈi13,ɲi442ɕiɛ̃n31t͡ɕʰi13-11ʂa53və442mə̃n21tə̃n442i21xa21lɔ21t͡sɛ13-22t͡ɕʰi13,ɲiɕiɛ̃nt͡ɕʰiʂavəmə̃ntə̃nixalɔt͡sɛt͡ɕʰi
LZ,Lanzhou,53,你抽烟不抽?/你抽不抽烟?,烟你抽哩么不抽?,,iɛ̃n ȵi tʂˈou li ma pu tʂˈou,iɛ̃n31 ȵi442 tʂˈou31 li21 ma21 pu13-11 tʂˈou31,iɛ̃n31ɲi442tʂʰou31li21ma21pu13-11tʂʰou31,iɛ̃nɲitʂʰoulimaputʂʰou
LZ,Lanzhou,54,你认得那个人不认得?,那个人你认得认不得,,lɛ kə ʐə̃n ȵi ʐə̃n tə ʐə̃n pu tə,lɛ13-11 kə53 ʐə̃n53 ȵi442 ʐə̃n13-11 tə53 ʐə̃n13-22 pu13-11 tə53,lɛ13-11kə53ʐə̃n53ɲi442ʐə̃n13-11tə53ʐə̃n13-22pu13-11tə53,lɛkəʐə̃nɲiʐə̃ntəʐə̃nputə
,,55,,,,,,,
,,56,,,,,,,
,,57,,,,,,,
,,58,,,,,,,
,,59,,,,,,,
