dialect_id,dialect_name,sentence_id,meaning,othography,english,ipa_no_tone,ipa_with_tone,ipa_converted_with_tone,ipa_converted_no_tone
WH,Wuhan,1,谁啊?我是老三。,哪个?我是老三,,na kuo ŋuo sɿ nau san,na42 kuo ŋuo sɿ35 nau42 san55,na42 kuo ŋuo sɹ̩35 nau42 san55,na kuo ŋuo sɹ̩ nau san
WH,Wuhan,2,老四呢?她正跟一个朋友说着话呢。,老四咧?她在跟一个朋友说话,,nau sɿ nie tˈa tai kən i kuo pˈoŋ iəu suo xua,nau42 sɿ35 nie tˈa55 tai35 kən55 i21321 kuo pˈoŋ21321 iəu42 suo21321 xua35,nau42 sɹ̩35 nie tʰa55 tai35 kən55 i21321 kuo pʰoŋ21321 iəu42 suo21321 xua35,nau sɹ̩ nie tʰa tai kən i kuo pʰoŋ iəu suo xua
WH,Wuhan,3,她还没说完吗?,她还冇说完,,tˈa xai mau suo uan,tˈa55 xai21321 mau35 suo21321 uan213,tʰa55 xai21321 mau35 suo21321 uan213,tʰa xai mau suo uan
WH,Wuhan,4,还没有。大概再有一会儿就说完了。,还冇，大概还有一哈儿就说完了,,xai mau ta kˈai xai iəu i xar tɕiəu suo uan niau,xai21321 mau35 ta35 kˈai35 xai21321 iəu42 i21321 xar tɕiəu35 suo21321 uan21321 niau,xai21321 mau35 ta35 kʰai35 xai21321 iəu42 i21321 xar t͡ɕiəu35 suo21321 uan21321 niau,xai mau ta kʰai xai iəu i xar t͡ɕiəu suo uan niau
WH,Wuhan,5,他说马上就走，怎么这半天了还在家里?,他说就走的，么样这半天还冇走,,tˈa suo tɕiəu ti mo iaŋ tsɤ pan tˈiɛn xai mau tsəu,tˈa55 suo21321 tɕiəu42 ti mo42 iaŋ tsɤ35 pan35 tˈiɛn55 xai21321 mau35 tsəu42,tʰa55 suo21321 t͡ɕiəu42 ti mo42 iaŋ t͡sɤ35 pan35 tʰiɛn55 xai21321 mau35 t͡səu42,tʰa suo t͡ɕiəu ti mo iaŋ t͡sɤ pan tʰiɛn xai mau t͡səu
WH,Wuhan,6,你到哪儿去?我到城里去。,你到哪里去?我到城里去,,ni tau na ni kˈɯ ŋuo tau tsˈən ni kˈɯ,ni42 tau35 na42 ni kˈɯ ŋuo42 tau35 tsˈən21321 ni kˈɯ35,ni42 tau35 na42 ni kʰɯ ŋuo42 tau35 t͡sʰən21321 ni kʰɯ35,ni tau na ni kʰɯ ŋuo tau t͡sʰən ni kʰɯ
WH,Wuhan,7,在那儿，不在这儿。,在那里，不在这里,,tai na ni pu tai tsɤ ni,tai35 na35 ni pu35 tai35 tsɤ35 ni,tai35 na35 ni pu35 tai35 t͡sɤ35 ni,tai na ni pu tai t͡sɤ ni
WH,Wuhan,8,不是那么做，要这么做。,不是那样办，是这样办,,pu sɿ na iaŋ pan sɿ tsɤ iaŋ pan,pu21321 sɿ35 na35 iaŋ pan35 sɿ35 tsɤ35 iaŋ pan35,pu21321 sɹ̩35 na35 iaŋ pan35 sɹ̩35 t͡sɤ35 iaŋ pan35,pu sɹ̩ na iaŋ pan sɹ̩ t͡sɤ iaŋ pan
WH,Wuhan,9,太多了，用不着那么多，只要这么多就够了。,太多了，用不倒那样多，光要这么多就够了,,tˈai tuo niau ioŋ pu tau na iaŋ tuo kuaŋ iau tsɤ mo tuo tçiəu kəu niau,tˈai35 tuo55 niau ioŋ35 pu tau na35 iaŋ tuo55 kuaŋ55 iau35 tsɤ35 mo tuo55 tçiəu35 kəu35 niau,tʰai35 tuo55 niau ioŋ35 pu tau na35 iaŋ tuo55 kuaŋ55 iau35 t͡sɤ35 mo tuo55 tçiəu35 kəu35 niau,tʰai tuo niau ioŋ pu tau na iaŋ tuo kuaŋ iau t͡sɤ mo tuo tçiəu kəu niau
WH,Wuhan,10,这个大，那个小，这两个哪一个好一点呢?,这个大，那个小，这两个哪个好一点儿,,tsɤ kuo ta na kuo ɕiau tsɤ niaŋ kuo na kuo xau i tier,tsɤ35 kuo ta35 na35 kuo ɕiau42 tsɤ35 niaŋ42 kuo na42 kuo xau42 i21321 tier,t͡sɤ35 kuo ta35 na35 kuo ɕiau42 t͡sɤ35 niaŋ42 kuo na42 kuo xau42 i21321 tier,t͡sɤ kuo ta na kuo ɕiau t͡sɤ niaŋ kuo na kuo xau i tier
WH,Wuhan,11,这个比那个好。,这个比那个好,,tsɤ kuo pi na kuo xau,tsɤ35 kuo pi42 na35 kuo xau42,t͡sɤ35 kuo pi42 na35 kuo xau42,t͡sɤ kuo pi na kuo xau
WH,Wuhan,12,这些房子不如那些房子好。,这些房子冇得那些房子好,,tsɤ ɕie faŋ tsɿ mau tɤ na ɕie faŋ tsɿ xau,tsɤ35 ɕie35 faŋ23121 tsɿ mau35 tɤ na35 ɕie55 faŋ21321 tsɿ xau42,t͡sɤ35 ɕie35 faŋ23121 t͡sɹ̩ mau35 tɤ na35 ɕie55 faŋ21321 t͡sɹ̩ xau42,t͡sɤ ɕie faŋ t͡sɹ̩ mau tɤ na ɕie faŋ t͡sɹ̩ xau
WH,Wuhan,13,这句话用成都话怎么说?,,,,,,
WH,Wuhan,14,拿得动吗?,拿不拿得动,,na pu na tɤ toŋ,na21321 pu na21321 tɤ toŋ35,na21321 pu na21321 tɤ toŋ35,na pu na tɤ toŋ
WH,Wuhan,15,我拿得动，他拿不动。,我拿得动，他拿不动,,ŋuo na tɤ toŋ tˈa na pu toŋ,ŋuo42 na21321 tɤ toŋ35 tˈa55 na21321 pu213 toŋ35,ŋuo42 na21321 tɤ toŋ35 tʰa55 na21321 pu213 toŋ35,ŋuo na tɤ toŋ tʰa na pu toŋ
WH,Wuhan,16,真不轻，重得连我也拿不动。,真不轻，重得我都拿不动了,,tsən pu tɕˈin tsoŋ tɤ ŋuo təu na pu toŋ niau,tsən55 pu tɕˈin55 tsoŋ35 tɤ ŋuo42 təu55 na21321 pu toŋ35 niau,t͡sən55 pu t͡ɕʰin55 t͡soŋ35 tɤ ŋuo42 təu55 na21321 pu toŋ35 niau,t͡sən pu t͡ɕʰin t͡soŋ tɤ ŋuo təu na pu toŋ niau
WH,Wuhan,17,你说得很好，你还会说点什么呢?,你说得蛮好，你还能说点么事,,ni suo tɤ man xau ni xai nən suo tiɛn mo sɿ,ni42 suo21321 tɤ man21321 xau42 ni42 xai21321 nən21321 suo21321 tiɛn42 mo42 sɿ,ni42 suo21321 tɤ man21321 xau42 ni42 xai21321 nən21321 suo21321 tiɛn42 mo42 sɹ̩,ni suo tɤ man xau ni xai nən suo tiɛn mo sɹ̩
WH,Wuhan,18,我嘴笨，我说不过他。,我嘴巴笨，说不过他,,ŋuo tsei pa pən suo pu kuo tˈa,ŋuo42 tsei42 pa pən35 suo21321 pu kuo35 tˈa55,ŋuo42 t͡sei42 pa pən35 suo21321 pu kuo35 tʰa55,ŋuo t͡sei pa pən suo pu kuo tʰa
WH,Wuhan,19,说了一遍，又说一遍。,说了一遍又一遍,,suo niau i piɛn iəu i piɛn,suo21321 niau i21321 piɛn35 iəu35 i21321 piɛn35,suo21321 niau i21321 piɛn35 iəu35 i21321 piɛn35,suo niau i piɛn iəu i piɛn
WH,Wuhan,20,请你再说一遍。,请你再说一遍,,tɕˈin ni tsai suo i piɛn,tɕˈin42 ni42 tsai35 suo21321 i21321 piɛn35,t͡ɕʰin42 ni42 t͡sai35 suo21321 i21321 piɛn35,t͡ɕʰin ni t͡sai suo i piɛn
WH,Wuhan,21,不早了，快去吧。,不早了，快点去吧,,pu tsau niau kˈuai tˈiər kˈɯ pa,pu21321 tsau42 niau kˈuai35 tˈiər42 kˈɯ35 pa,pu21321 t͡sau42 niau kʰuai35 tʰiər42 kʰɯ35 pa,pu t͡sau niau kʰuai tʰiər kʰɯ pa
WH,Wuhan,22,现在还早着呢，等一会儿再去吧。,这喒还早咧，等一哈儿再去,,tsən tsan xan tsau nie tən i xar tsai kˈɯ,tsən35 tsan xan21321 tsau42 nie tən42 i21321 xar tsai35 kˈɯ35,t͡sən35 t͡san xan21321 t͡sau42 nie tən42 i21321 xar t͡sai35 kʰɯ35,t͡sən t͡san xan t͡sau nie tən i xar t͡sai kʰɯ
WH,Wuhan,23,吃了饭再去好吗?,吃了饭再去好不好,,tɕˈi niau fan tsai kˈɯ xau pu xau,tɕˈi21321 niau fan35 tsai35 kˈɯ35 xau42 pu xau42,t͡ɕʰi21321 niau fan35 t͡sai35 kʰɯ35 xau42 pu xau42,t͡ɕʰi niau fan t͡sai kʰɯ xau pu xau
WH,Wuhan,24,慢慢儿吃啊，不要着急。,慢慢地吃，莫急,,man man ti tɕˈi mo tɕi,man35 man35 ti tɕˈi213 mo21321 tɕi213,man35 man35 ti t͡ɕʰi213 mo21321 t͡ɕi213,man man ti t͡ɕʰi mo t͡ɕi
WH,Wuhan,25,坐着吃比站着吃好些。,坐倒吃比站倒吃好些,,tsuo tau tɕˈi pi tsan tau tɕˈi xau ɕie,tsuo35 tau tɕˈi21321 pi42 tsan42 tau tɕˈi21321 xau42 ɕie,t͡suo35 tau t͡ɕʰi21321 pi42 t͡san42 tau t͡ɕʰi21321 xau42 ɕie,t͡suo tau t͡ɕʰi pi t͡san tau t͡ɕʰi xau ɕie
WH,Wuhan,26,他吃了饭了，你吃了饭没有呢?,他吃了饭了，你吃了冇,,tˈa tɕˈi niau fan niau ni tɕˈi niau mau,tˈa55 tɕˈi21321 niau fan35 niau ni42 tɕˈi21321 niau mau35,tʰa55 t͡ɕʰi21321 niau fan35 niau ni42 t͡ɕʰi21321 niau mau35,tʰa t͡ɕʰi niau fan niau ni t͡ɕʰi niau mau
WH,Wuhan,27,他去过上海，我没有去过。,他去过上海，我冇去过,,tˈa kˈɯ kuo saŋ xai ŋuo mau kˈɯ kuo,tˈa55 kˈɯ35 kuo saŋ35 xai42 ŋuo42 mau35 kˈɯ35 kuo,tʰa55 kʰɯ35 kuo saŋ35 xai42 ŋuo42 mau35 kʰɯ35 kuo,tʰa kʰɯ kuo saŋ xai ŋuo mau kʰɯ kuo
WH,Wuhan,28,来闻闻这朵花香不香。,来闻下咧朵花香不香,,nai uən xa nɤ tuo xua ɕiaŋ pu ɕiaŋ,nai21321 uən21321 xa nɤ35 tuo42 xua55 ɕiaŋ55 pu ɕiaŋ55,nai21321 uən21321 xa nɤ35 tuo42 xua55 ɕiaŋ55 pu ɕiaŋ55,nai uən xa nɤ tuo xua ɕiaŋ pu ɕiaŋ
WH,Wuhan,29,给我一本书。,把本书我,,pa pən ɕy ŋuo,pa42 pən42 ɕy55 ŋuo42,pa42 pən42 ɕy55 ŋuo42,pa pən ɕy ŋuo
WH,Wuhan,30,我真的没有那本书呀。,我真的冇得那本书嚜,,ŋuo tsən ti mau tɤ na pən ɕy me,ŋuo42 tsən55 ti mau35 tɤ na55 pən42 ɕy55 me,ŋuo42 t͡sən55 ti mau35 tɤ na55 pən42 ɕy55 me,ŋuo t͡sən ti mau tɤ na pən ɕy me
WH,Wuhan,31,你告诉他。,你告信诉他,,ni kau ɕin tˈa,ni42 kau35 ɕin35 tˈa55,ni42 kau35 ɕin35 tʰa55,ni kau ɕin tʰa
WH,Wuhan,32,好好地走，不要跑。,好好地走，莫跑,,xau xau ti tsəu mo pˈau,xau42 xau42 ti tsəu42 mo21321 pˈau213,xau42 xau42 ti t͡səu42 mo21321 pʰau213,xau xau ti t͡səu mo pʰau
WH,Wuhan,33,小心跌下去爬不上来。,小心跶下去爬不上来,,ɕiau ɕin ta ɕia kˈɯ pˈa pu saŋ nai,ɕiau42 ɕin55 ta21321 ɕia kˈɯ pˈa21321 pu saŋ35 nai,ɕiau42 ɕin55 ta21321 ɕia kʰɯ pʰa21321 pu saŋ35 nai,ɕiau ɕin ta ɕia kʰɯ pʰa pu saŋ nai
WH,Wuhan,34,医生叫你多睡睡。,医生叫你多睡下子,,i sən tɕiau ni tuo suei xa tsɿ,i55 sən tɕiau35 ni42 tuo55 suei35 xa35 tsɿ,i55 sən t͡ɕiau35 ni42 tuo55 suei35 xa35 t͡sɹ̩,i sən t͡ɕiau ni tuo suei xa t͡sɹ̩
WH,Wuhan,35,抽烟或者喝茶都不许。,吃烟、喝茶都不许,,tɕˈi iɛn xuo tsˈa təu pu ɕy,tɕˈi21321 iɛn55 xuo21321 tsˈa21321 təu55 pu ɕy42,t͡ɕʰi21321 iɛn55 xuo21321 t͡sʰa21321 təu55 pu ɕy42,t͡ɕʰi iɛn xuo t͡sʰa təu pu ɕy
WH,Wuhan,36,烟也好，茶也好，我都不喜欢。,烟也好，茶也好，我都不喜欢,,iɛn ie xau tsˈa ie xau ŋuo təu pu ɕi xuan,iɛn55 ie42 xau42 tsˈa21321 ie42 xau42 ŋuo42 təu55 pu ɕi42 xuan55,iɛn55 ie42 xau42 t͡sʰa21321 ie42 xau42 ŋuo42 təu55 pu ɕi42 xuan55,iɛn ie xau t͡sʰa ie xau ŋuo təu pu ɕi xuan
WH,Wuhan,37,不管你去不去，反正我是要去的。,不管你去不去，反正我是一定要去的,,pu kuan ni kˈɯ pu kˈɯ fan tsən ŋuo sɿ i tin iau kˈɯ ti,pu21321 kuan42 ni42 kˈɯ35 pu kˈɯ35 fan42 tsən35 ŋuo42 sɿ35 i21321 tin35 iau35 kˈɯ35 ti,pu21321 kuan42 ni42 kʰɯ35 pu kʰɯ35 fan42 t͡sən35 ŋuo42 sɹ̩35 i21321 tin35 iau35 kʰɯ35 ti,pu kuan ni kʰɯ pu kʰɯ fan t͡sən ŋuo sɹ̩ i tin iau kʰɯ ti
WH,Wuhan,38,我非去不可。,我非去不可,,ŋuo fei kˈɯ pu kˈuo,ŋuo42 fei55 kˈɯ35 pu21321 kˈuo42,ŋuo42 fei55 kʰɯ35 pu21321 kʰuo42,ŋuo fei kʰɯ pu kʰuo
WH,Wuhan,39,你是哪一年来的?,你哪年来的,,ni na niɛn nai ti,ni42 na42 niɛn21321 nai21321 ti,ni42 na42 niɛn21321 nai21321 ti,ni na niɛn nai ti
WH,Wuhan,40,我是前年到的北京。,我是前年到北京的,,ŋuo sɿ tɕˈiɛn niɛn tau pɤ tɕin ti,ŋuo42 sɿ35 tɕˈiɛn21321 niɛn21321 tau35 pɤ21321 tɕin55 ti,ŋuo42 sɹ̩35 t͡ɕʰiɛn21321 niɛn21321 tau35 pɤ21321 t͡ɕin55 ti,ŋuo sɹ̩ t͡ɕʰiɛn niɛn tau pɤ t͡ɕin ti
WH,Wuhan,41,今天开会谁的主席?,今天开会哪个是主席,,tɕin tˈiɛn kˈai xuei na kuo sɿ tɕy ɕi,tɕin55 tˈiɛn55 kˈai55 xuei35 na42 kuo sɿ35 tɕy42 ɕi,t͡ɕin55 tʰiɛn55 kʰai55 xuei35 na42 kuo sɹ̩35 t͡ɕy42 ɕi,t͡ɕin tʰiɛn kʰai xuei na kuo sɹ̩ t͡ɕy ɕi
WH,Wuhan,42,你得请我的客。,你该请我的客,,ni kai tɕˈin ŋuo ti kˈɤ,ni42 kai55 tɕˈin42 ŋuo42 ti kˈɤ213,ni42 kai55 t͡ɕʰin42 ŋuo42 ti kʰɤ213,ni kai t͡ɕʰin ŋuo ti kʰɤ
WH,Wuhan,43,一边走，一边讲。,一路走，一路说,,i nəu tsəu i nəu suo,i21321 nəu35 tsəu42 i21321 nəu35 suo213,i21321 nəu35 t͡səu42 i21321 nəu35 suo213,i nəu t͡səu i nəu suo
WH,Wuhan,44,越走越远，越说越多。,越走越远，越说越多,,ye tsəu ye yɛn ye suo ye tuo,ye21321 tsəu42 ye21321 yɛn42 ye21321 suo21321 ye21321 tuo55,ye21321 t͡səu42 ye21321 yɛn42 ye21321 suo21321 ye21321 tuo55,ye t͡səu ye yɛn ye suo ye tuo
WH,Wuhan,45,把那个东西拿给我。,把那个东西把我,,pa na kuo toŋ ɕi pa ŋuo,pa42 na35 kuo toŋ55 ɕi pa42 ŋuo42,pa42 na35 kuo toŋ55 ɕi pa42 ŋuo42,pa na kuo toŋ ɕi pa ŋuo
WH,Wuhan,46,有些地方把太阳叫日头。,有些地方把太阳叫日头,,ieu ɕie ti faŋ pa tˈai iaŋ tɕiau ɯ tˈəu,ieu42 ɕie55 ti35 faŋ pa42 tˈai35 iaŋ tɕiau35 ɯ21321 tˈəu,ieu42 ɕie55 ti35 faŋ pa42 tʰai35 iaŋ t͡ɕiau35 ɯ21321 tʰəu,ieu ɕie ti faŋ pa tʰai iaŋ t͡ɕiau ɯ tʰəu
WH,Wuhan,47,您贵姓?我姓王。,你家贵姓?我姓王,,ni tɕia kuei ɕin ŋuo ɕin uaŋ,ni42 tɕia55 kuei35 ɕin35 ŋuo42 ɕin35 uaŋ213,ni42 t͡ɕia55 kuei35 ɕin35 ŋuo42 ɕin35 uaŋ213,ni t͡ɕia kuei ɕin ŋuo ɕin uaŋ
WH,Wuhan,48,你姓王我也姓王，咱们两个人都姓王。,你姓王，我也姓王，我们两个都姓王,,ni ɕin uaŋ ŋuo ie ɕin uaŋ ŋuo mən niaŋ kuo təu ɕin uaŋ,ni42 ɕin35 uaŋ213 ŋuo21321 ie42 ɕin35 uaŋ213 ŋuo21321 mən niaŋ42 kuo təu55 ɕin35 uaŋ213,ni42 ɕin35 uaŋ213 ŋuo21321 ie42 ɕin35 uaŋ213 ŋuo21321 mən niaŋ42 kuo təu55 ɕin35 uaŋ213,ni ɕin uaŋ ŋuo ie ɕin uaŋ ŋuo mən niaŋ kuo təu ɕin uaŋ
WH,Wuhan,49,你先去吧，我们等一会儿再去。,你先去吧，我们等一下再去,,ni ɕiɛn kˈɯ pa ŋuo mən tən i xar tsai kˈɯ,ni42 ɕiɛn55 kˈɯ35 pa ŋuo42 mən tən42 i21321 xar tsai35 kˈɯ35,ni42 ɕiɛn55 kʰɯ35 pa ŋuo42 mən tən42 i21321 xar t͡sai35 kʰɯ35,ni ɕiɛn kʰɯ pa ŋuo mən tən i xar t͡sai kʰɯ
WH,Wuhan,50,你抽烟不抽?,你吃不吃烟,,ni tɕˈi pu tɕˈi iɛn,ni42 tɕˈi21321 pu tɕˈi21321 iɛn55,ni42 t͡ɕʰi21321 pu t͡ɕʰi21321 iɛn55,ni t͡ɕʰi pu t͡ɕʰi iɛn
WH,Wuhan,51,你认得那个人不认得?,你认不认得那个人,,ni zən pu zən tɤ na kuo zən,ni42 zən35 pu zən35 tɤ na35 kuo zən213,ni42 zən35 pu zən35 tɤ na35 kuo zən213,ni zən pu zən tɤ na kuo zən
WH,Wuhan,,,,,,,,
WH,Wuhan,,,,,,,,
WH,Wuhan,,,,,,,,
WH,Wuhan,,,,,,,,
WH,Wuhan,,,,,,,,
