sentence_id,Beijing,Chengdu,Guiyang,Nanchang,Taibei,Taiyuan,Xianggang,Xiangtan,Xining,Hefei,Meixian
1,ʂei a uo ʂɻ̩ lau san,na ko ŋo sɹ̩ nau san,la ko ŋo sɹ̩ lao san,lɑ ko o ŋo sɹ̩ lɑu san lo,siã bĩʔ laŋ gua si lau sã,suei lɤ ɣɤ sɹ̩ lau sæ̃,pin kɔ a ŋɔ hɐi a sam,nɒ ko ŋo ʂɻ̩ naɯ san,fɨ a nɔ sɹ̩ lɔ sã na,xa kə ʊ ʂɻ̩ lɔ sæ̃,man ŋin na ŋai he a sam
2,lau sɹ̩ nə tˈa tʂəŋ kən i pˈəŋ iou ʂuo tʂə xuar nə,nau sɹ̩ nan tˈa tsən tsai kən i ko pˈoŋ iəu so xua ni,lao sɹ̩ lɛ la tsen tsai xo i ko pˈoŋ iəu so tɕˈi xua lɛ lɛ,lɑu sɹ̩ li tɕie tsɨn tsˈai kiɛn iʔ kɔ pˈuŋ iu tˈan tˈo,lau si e le i tŋ̩ te kaʔ tsit le piŋ iu kɔŋ ue,lau sɹ̩ lɤ tˈa tsəŋ kəŋ iəʔ kɤ pˈəŋ iəu tau ɕiəʔ lɤ,a sei nɛ kˈøy hɐi tou tˈuŋ kɔ pˈɐŋ jɐu kˈiŋ kɐn kɐi lɛ,naɯ sɻ̩ nie tɒ tʂən dzai ɦo i tʂo pˈən iəɯ tɒ tˈai bian kɔn,lɔ sɹ̩ lɛ tɕia tʂə̃ j kɔ pˈə̃ iɯ lia ɕyã tʂɛ,lɔ sɻ̩ tsɤ la kə tsə tˈa kən iəʔ kə pˈən iɯ tɕiɑ̃ tʂɻ̩ xua tsɤ,a si a ki tsaŋ tˈuŋ it tsak pˈen iu hok ke= e liau
3,tˈa xai mei ʂuo uan ma,tˈa xai mei iəu so uan a ,la xai mei tɛ so uan a,tɕie haʔ mɑu tˈan uɵn nɑ,i ia bueʔ kɔŋ suaʔ hio,tˈa xai məʔ tau ɕiəʔ væ̃ lɤ,kˈøy tsuŋ mei kɔŋ jyn mɛ,tɒ ɦai maɯ kɔn yẽ po,tɕia xɛ mɔ fɔ uã mɔ,tˈa kˈə ʂɻ̩ xɤ me tɕiɑ̃ ʊ̃,ki m̩ tˈien koŋ pˈei he m̩ me
4,xai mei nə ku mə tʂə tsai xuər tɕiou ʂuo uan lə,xai mei iəu ta yo xai iəu i xər tɕiəu so uanno,xai mei tɛ to pan xai iəu i xa xa təu so uan ləu,haʔ mɑu tsˈɑ pɨʔ to tsai iu tɛʔ iʔ hɑ tsɹ̩ tɕiu tˈan uɵn liɛu,ia bue tai iɔʔ tsit tiam a tioʔ kɔŋ suaʔ,xai məʔ la ta kai tsai iəu iəʔ tsəŋ tsəŋ tɕiəu tau ɕiəʔ væ̃ lie,tsuŋ mei tai kˈɔi tsɔi kɔ jɐt tsɐn tsɐu kɔŋ jyn lak,ɦai maɯ dai kˈai tsai kɔn i tsən tsɹ̩ dʑiəɯ kɔn yẽ tɒ,xɛ mɔ ta kˈuɔ̃ mv̩ ɛ tsɛ j kua kua ɛ xɔ tɕiɯ fɔ uã liɔ,xɤ me ta yeʔ mɐʔ tsɤ iɯ iəʔ ʂɐʔ tɕiɯ tʂəŋ lə,han maŋ tˈien ten it ha tˈiam ki tsˈu voi koŋ pˈet le
5,tˈa ʂuo li mar tɕiou tsou tsəm səm pan tˈian lə xai tsai tɕia li,tˈa tɕiaŋ ma saŋ tɕiəu tsəu tsa ko tse mən tɕiəu no xai tsai u tˈəu ne,la so lɛ li ma təu tsəu tsa ko tsɹ̩ iaŋ ta pan tˈian ao xai tsai u tˈəu lɛ,tɕie uɑ mɑ sɔŋ tɕˈiu tsɛu lɔŋ lo pɵn ɲiʔ liɛu haʔ tsˈai uɨʔ li mɑ,i kɔŋ sui beʔ kiã nã e kui puã kaŋ a ia ti tsˈu lai,tˈa suəʔ liəʔ ma tɕiəu tsaʔ ti tsəʔ pæ̃ tˈie lie xai tsai tɕia lɤ,kˈøy wa tsik hak tsɐu tsɐu tim kai kɐm nɔi tsuŋ hɐi uk kˈei tou,tɒ kɔn səi tɕi dʑiəɯ tsəɯ i ti kai ko mo pɔn tˈiẽ tɒ ɦai dzai u ni,tɕia fɔ tɕiɯ tsɯ lia a mə̃ tʂɻ̩ mə̃ pã tˈiã liɔ tʂɔ xɛ tɛ tɕia l̩ lia,tˈa tɕiɑ̃ ma ʂɑ̃ tɕiɯ tsɯ tɕiɑ̃ kɔ ti pʊ̃ tˈiɪ̃ xɤ tɕia zɹ̩ tˈɯ,ki va lik lak tsˈiu tseu ŋioŋ an kiu ve han tsˈoi vuk kˈa
6,ni ʂɑŋ nar tɕˈy uo tɕin tʂˈəŋ tɕˈi,ɲi tsəu nər tɕˈie ŋo tau tsˈən xəu tˈəu tɕˈie,li tsəu la tai kˈi ei ŋo tsəu tsˈen tˈəu kˈi,n̩ tɑu lɑ li tɕˈie ɑ ŋo tɕin sɑŋ tɕˈie,li kˈi to ui gua kˈi siã lai,ni tɕˈy na kəʔ ia ɣɤ tɕˈy tsˈəŋ li kəʔ ia,nei høy pin ŋɔ jɐp sɛŋ,ɲi taɯ nɒ tɔn tɕˈie ŋo taɯ dʐən ni tɕˈie,ɲi a tʂa tɕˈj lia nɔ tʂˈə̃ l̩ tɕˈj kɔ lia,li tɔ la kˈiɤ tsˈɥ ʊ tɔ tɕiɤ ʂɑ̃ tsˈɥ,n̩ hi nai ie ŋai hi tsˈut ke
7,tsai nar pu tsai tʂər,tsai nər pu tsai tsər,tsai a tiɛ pu tsai tsɹ̩ tiɛ,tsˈai he li pɨʔ tsˈai ko li,ti hia bo ti tsia,tsai var tɕia pəʔ tsai tsar tɕia,hɐi kɔ tou m hɐi nei tou,dzai nɒ tɔn maɯ dzai ko tɔn,tɛ nɛ tʂa lia mɔ tɛ tʂɻ̩ tʂa tʂɔ,tsɤ la ɔ tsə pəʔ tsɤ ti ɔ tsə,hoi ke ie m̩ me e ie
8,pu nam tʂə tei tʂəm tʂə,pu sɹ̩ na iaŋ tsɹ̩ tsu iau tse iaŋ tsɹ̩ tsu,pu sɹ̩ a iaŋ tsəu sɹ̩ iao ɕiaŋ tsɹ̩ iaŋ tsəu lɛ,pɨʔ sɹ̩ hɛn tsu ko iɛu kɔŋ tsu,m̩ si a nẽ tso si tioʔ a nĩ tso,pəʔ sɹ̩ vai təʔ tsuəʔ sɹ̩ tsai təʔ tsuəʔ,m hɐi kɐm tsou hɐi jiu kɐm tsou kɛ,pu ʂɻ̩ iaɯ nɒ ian tsəɯ ʂɻ̩ iaɯ ko ian tsəɯ,nɛ mə̃ tɕia tɕy xɔ mɔ tuɨ tʂɔ iɔ tʂɻ̩ mə̃ tɕia tɕy lia,pəʔ ʂɻ̩ la iɑ̃ kɔ iɔ ti iɑ̃ kɔ,m̩ me ke an ne tso oi e ŋioŋ ŋe tso
9,tˈei tuo lə yŋ pu tʂau nam tuo tʂɻ̩ iau tʂəm tuo tɕiou kou lə,tˈai to no yoŋ pu tau na mən to tsɹ̩ iau tse mən to tɕiəu kəu no,tˈai to la iao pu tao a iaŋ to tsɹ̩ iao tsɹ̩ iaŋ to təu kəu la,tˈai to sɔŋ liɛu pɨʔ iɛu he to tsɨʔ iɛu ko to tsɹ̩ tɕˈiu kiɛu liɛu,siũ tse a m̩ bian hia nĩ tse,tˈau tɤ lie yəŋ pəʔ lau vəʔ lai tɤ kuɒ̃ tsəʔ ɕiar tɕiəu kəu lie,tɔ tɐk tsɐi la m sɐi kɐm tɔ jiu kɐm tɔ tsɐu kɐu la,tˈai to tɒ iaɯ pu niaɯ nɒ ian to tʂɻ̩ iaɯ ko ian to dziəɯ iəɯ tɒ,tˈɛ tu liɔ nɛ mə̃ tu xɔ yə̃ pv̩ uã na tʂɻ̩ mə̃ ɕi xɔ tɕiɯ kɯ liɔ,tˈɤ tʊ tʂə iŋ pəʔ tʂuɐʔ la iɑ̃ tʊ tʂəʔ iɔ ti iəʔ xɔ tɕiɯ kɯ tʂə,tˈiet to e m̩ sɹ̩ an to oi an to e tsˈiu keu ve
10,tʂei kə ta nei kə ɕiau tʂei lia nei kə xɑu tiar,tse ko ta na ko ɕiau tse niaŋ ko na i ko xau i tiər,tsɹ̩ ko ta a ko ɕiao tsɹ̩ liaŋ ko tao ti la ko iao xao i tɛ lɛ,kei tsɑʔ tˈai he tsɑʔ ɕiɛu ko liɔŋ tsɑʔ lɑ tsɑʔ hɑu tiɑʔ tsɹ̩ le,tsit le tua hit le se tsit lŋ̩ e to tsit le kˈaʔ ho,tsai ta vai ɕiau tsəʔ lia kɤ  na kɤ xau ɕiar,nei kɔ tai kɔ kɔ sɐi nei lœŋ kɔ pin kɔ hou ti nɛ,ko tʂɒ dai nɒ tʂɒ siaɯ ko nian tʂo nɒ i tʂo haɯ i tiẽ,tʂɻ̩ kɔ ta nɛ kɔ ka tʂɻ̩ liɔ̃ kɔ a j kɔ xɔ ɛ ɕi,ti kə ta la kə ɕiɔ ti liɑ̃ kə xa kə xɔ xɔ tsə,e tsak kuo tˈai ke tsak kuo se e lioŋ tsak na ŋai tsak kˈo hau
11,tʂei kə pi nei kə xau,tse ko kan na ko xau,tsɹ̩ ko ken pi a ko xao,kei tsɑʔ pi he tsɑʔ hɑu,tsit le pi hit le kˈaʔ ho,tsai pi vai xau,nei kɔ hou kwɔ kɔ kɔ,ko tʂo pi nɒ tʂo haɯ,tʂɻ̩ kɔ pj nɛ kɔ xɔ,ti kə pɹ̩ la kə xɔ,e tsak pi e tsak kuo hau
12,tʂei ɕiɛ fɑŋ tsɹ̩ pu pi nei ɕiɛ fɑŋ tsɹ̩ xau,tse ɕi faŋ tsɹ̩ mo te na ɕi faŋtsɹ̩ xau,tsɹ̩ ɕiɛ faŋ tsɹ̩ pu tɛ a ɕiɛ faŋ tsɹ̩ xao,kei ɕiɛʔ uʔ mɑu iu he ɕiɛʔ uʔ hɑu,tsia e tsˈu bo hia e tsˈu ho,tsəʔ ɕie fɒ̃ tsəʔ məʔ la vəʔ ɕie fɒ̃ tsəʔ xau,nei ti uk pɐt jy kɔ ti uk hou,ko xie ɦɔn tsɹ̩ pu pi nɒ sie ɦɔn tsɹ̩ haɯ,tʂɻ̩ ɕi fɔ̃ tsɻ̩ mɔ iɯ nɛ ɕi fɔ̃ tsɻ̩ xɔ,ti sɹ̩ fɑ̃ tsə pəʔ tɕiəʔ la sɹ̩ fɑ̃ tsə xɔ,e teu vuk e mo ke teu vuk e an liaŋ
13,,tse tɕy xua yoŋ tsˈəntu xua tsa ko so,,,,,,,,,
14,tˈa tɕin nian tuo ta suei ʂurlə,tˈa tɕin ɲian xau ta suei su no,la tɕin lian xao ta la,tɕie tɕin ɲiɛn tsɹ̩ tɕi to sui lo,i kin lĩ u kui hue lo,tˈa tɕiəŋ nie tɤ ta lie,kˈøy kɐm nin kei tai la,tˈɒ tɕin ɲiẽ haɯ to səi tɒ,tɕia tɕiə̃ ɲiã tu ta suɨ fv̩ liɔ,tˈa tɕin liɪ̃ xɔ ta se sʊ lə,ki kin ŋian ki to se e
15,ta kai tɕˈi san ʂɻ̩ lai suər pa,pˈa iəu san sɹ̩ saŋ ɕia no,pˈa iəu san sɹ̩ lai suei ləu ma,tsˈɑ pɨʔ to san sɨʔ lɑ sui pa,ta kˈai u sã tsap kui hui a,ta kai sæ̃ səʔ lai suei va,jœk mɔk sam sɐp lɛŋ søy la,io mo san ʂɹ̩ tɕˈy tiẽ dəɯ pai,ta kˈuɔ̃ mv̩ ɛ sã ʂɻ̩ lɛ suɨ iɯ lia,ta yɐʔ mɐʔ sæ̃ ʂəʔ uɑ̃ se pa,sam səp se tso iu
16,tʂei tuŋ ɕi iou tuo tʂˈən,tse ko toŋ ɕi iəu xau tsoŋ,tsɹ̩ ko toŋ ɕi iəu xao tsoŋ a,ko tsɑʔ tuŋ ɕi iu tɕi tsˈuŋ tso,tsit le bĩʔ kin taŋ le,tsai tuəŋ ɕi iəu tɤ lai tsuəŋ lɤ,nei kɔ jɛ jɐu kei tsˈuŋ nɛ,ko tʂɒ tən si iəɯ haɯ dʐən nie,tʂɻ̩ kɔ tuə̃ ɕj a mə̃ tʂuə̃ tsɹ̩ kɔ iɯ lia,ti kə təŋ sɹ̩ tsə iɯ xɔ tʂəŋ a,e ke tuŋ si iu ki tsˈuŋ ŋe
17,iou u ʂɻ̩ tɕin tʂuŋ nə,iəu u sɹ̩ tɕin tsoŋ o,iəu u sɹ̩ tɕin tsoŋ lɛ,iu ŋ̩ sɨʔ tɕin tsˈuŋ ŋe,u gɔ tsap kin taŋ le,iəu vu səʔ tɕiəŋ tsuəŋ lɤ,siŋ ŋ sɐp kɐn tsˈuŋ,iəɯ ɯ ʂɻ̩ tɕin dʐən,v̩ ʂɻ̩ tɕiə̃ iɯ lia,iɯ u ʂəʔ tɕin tʂəŋ ʊ,iu n̩ səp kuo kin tsˈiŋ ŋo
18,na tə tuŋ ma,nau te tɕˈi pu,la tɛ toŋ pu,lɑʔ tɛʔ tˈuŋ po,tˈeʔ u huaʔ bo,na tuəŋ alu,nik tɐk juk ma,nɒ tæ tɕˈi pu,na tuə̃ lia,kˈə la təŋ a,na tet hi mo
19,uo na tə tuŋ tˈa na pu tuŋ,ŋo nau te tɕˈi tˈa nau pu tɕˈi,ŋo la tɛ toŋ la la pu toŋ,ŋo lɑʔ tɛʔ tˈuŋ tɕiɛ lɑʔ pɨʔ tˈuŋ,gua tˈeʔ u huaʔ i tˈeʔ bo huaʔ,ɣɤ na tuəŋ lau tˈa na pəʔ tuəŋ,ŋɔ nik tɐk juk kˈøy nik m juk,ŋo nɒ tæ tɕˈi tˈɒ nɒ pu tɕˈi,nɔ na tuə̃ lia tɕia na tuə̃ l̩ pɔ̃ xɔ,ʊ la təŋ tˈa la pəʔ təŋ,ŋai na atet hi ki na m̩ hi
20,tʂən pu tɕˈiŋ tʂˈən tə lian uo iɛ na pu tuŋ,ŋən sɹ̩ pu tɕˈin o tsoŋ te nian ŋo təu nau pu tɕˈi,ŋen sɹ̩ pu tɕˈin lɛ tsoŋ tɛ lian ŋo təu la pu toŋ,tɔʔ tsɨn man tsˈuŋ tsˈuŋ tɛʔ liɛn ŋo tu lɑʔ pɨʔ tˈuŋ,sit tsai bo kˈin taŋ ka lien gua bã tˈeʔ bue tin taŋ,tsəŋ pəʔ tɕˈiəŋ tsuəŋ təʔ lie ɣɤ ie na pəʔ tuəŋ,tsɐn hɐi m hɛŋ tsˈuŋ tou lin ŋɔ tou nik m juk,tsən tʂən pu tɕˈin dʐən tæ taɯ ŋo təɯ nɒ pu tɕˈi,ʂɻ̩ xua pv̩ tɕˈiə̃ na tʂuə̃ tʂɔ liã nɔ a na pv̩ tuə̃ na,tʂən pəʔ tɕˈin liɪ̃ ʊ tɯ la pəʔ təŋ,ai ia hau tsˈuŋ ŋo lien ŋai ia na m̩ to hi
21,ni ʂuo tə tˈiŋ xɑu ni xai nəŋ ʂuo tiar ʂəm nə,ɲi so te xau xau ɲi xai xuei so tiər sa tsɹ̩ ne,li so tɛ xao tɛ xen li xai xuei so ɕiɛ la iaŋ lɛ,n̩ uɑ tɛʔ man hɑu n̩ haaʔ ui uɑ tiɑʔ tsɹ̩ sɨʔ li le,li kɔŋ ka tsin ho li e hiau kɔŋ siã bĩʔ,ni suaʔ tiəʔ kˈaʔ xau lɤ ni xai xuei suaʔ ɕiar səŋ lɤ,nei kɔŋ tɐk hou hou nei tsuŋ sik kɔŋ ti mɐt jɛ nɛ,ɲi kɔn tæ man haɯ ɲi ɦai ɕiaɯ tæ kɔn tiẽ ʂən mo nie,ɲi fɔ tʂɔ xv̩ xɔ ɲi xɛ xuɨ fɔ ɛ ɕi sa lia,li tɕiɑ̃ tiəʔ xɔ xən li xɤ lən tɕiɑ̃ xɔ xəŋ kə lə,n̩ səp fun̩ liak koŋ n̩ han iu mak ke koŋ ke
22,uo tsuei pən uo ʂuo pu kuo tˈa,ŋo tsuei pa pən ŋo tɕiaŋ pu in tˈa,ŋo lɛ tsuei pen tɛ xen ŋo so pu in la,ŋo tsui pɑ pɨi uɑ ŋo uɑ tɕie pɨʔ iɑŋ,bo tsˈui bo tsiʔ gua kɔŋ be iã i,ɣɤ tsuei pəŋ ɣɤ suaʔ pəʔ kuɤ tˈa,ŋɔ m sik kɔŋ jɛ ŋɔ kɔŋ m kwɔ kˈøy,ŋo tsəi pɒ mo ŋ kɔn tˈɒ pu ku,nɔ tsuɨ tʂuɛ a nɔ pa tɕia fɔ pv̩ ku,ʊ tse pən ʊ tɕiɑ̃ pəʔ kʊ tˈa,ŋai ke tsoi səp fun pˈun ŋai koŋ m̩ kuo ki
23,ʂuo lə i pian iou ʂuo i pian,so no i tau iəu so i tau,so əu i pian iəu so i pian,uɑ liɛu iʔ tɑu iu uɑ iʔ tɑu,kɔŋ liau tsit pai koʔ kɔŋ tsit pai,suaʔ lau iəʔ pie iəu suaʔ iəʔ pie,kɔŋ tsɔ jɐt tsˈi jɐu kɔŋ jɐt tsˈi,kɔn tɒ i taɯ iəɯ kɔn i taɯ,fɔ kɨ liɔ j tsˈa na kˈɔ fɔ liɔ j tsˈa,tɕiɑ̃ tʂə iəʔ piɪ̃ iɯ tɕiɑ̃ iəʔ piɪ̃,koŋ ŋe it tson iu han oi koŋ it tson
24,nin tsai ʂuo i pian,tɕˈin ɲi tsai so i tau,ma fan li tsai so i pian xa,tɕˈiɑŋ n̩ tsai uɑ iʔ tɑu,tsˈiã li koʔ kɔŋ tsit pai,tɕˈiəŋ ni tsai suaʔ iəʔ pie va,tsˈɛŋ nei tsɔi kɔŋ jɐt tsˈi,tsˈian ɲi tsai kɔn i taɯ,tsɔ ɲi tsɛ fɔ j tsˈa,tɕˈin li tsɤ tɕiɑ̃ iəʔ piɪ̃,tsˈiaŋ n̩ tsoi koŋ it tson
25,pu tsɑu lə ma liər tɕˈy pa,pu tsau no kˈuai tiər tɕˈie,pu tsao əu kˈuai tai tɕˈi ləu,tsˈɑ pɨʔ to lo kˈuai tɕˈie sɑ,bo tsa lo kin kˈi o,pəʔ tsau lie kˈuai tɕˈy va,hou an la fai ti høy la,ŋan kɒ tɒ kˈuai tiẽ tɕˈie no,tsˈɹ̩ liɔ tsɔ kã tɕiə̃ tɕˈj pa,pəʔ tsɔ lə kˈuɤ xɔ tsˈɥ pa,m̩ tsau ve kˈuai tit loi hi
26,tʂei xuər xai tsɑu tʂə nə tai xuər tsai tɕˈy pa,tse xər xai tsau tən xa xər tsai tɕˈie ma,tsɹ̩ xa xai tsao tɛ xen lɛ ten i xa tsai tɕˈi ma,ko ɕiɛn tsˈai haʔ tsɑu tɛʔ ŋɔʔ le ŋan ɑ tsɹ̩ tsai tɕˈie lo,tsit bã ia koʔ tsa e sio tan tsit le tsiaʔ koʔ kˈi la,tsəʔ tsəŋ tsəŋ xai tsau təʔ lɤ təŋ iəʔ tsəŋ tsəŋ tsai tɕˈy va,ji ka tsuŋ hou tsɛ tɐŋ jɐt tsɐn sin tsi høy la,ko ʂɻ̩ sɻ̩ ɦai tsaɯ tɒ ku i kˈæ dʑi tsai tɕˈie,tsɔ xɛ tsɔ tʂɛ tə̃ j kua liɔ tsɛ tɕˈj sa,tʂɑ̃ kə xɤ tsɔ xən tən iəʔ ʂɐʔ tsɤ tsɥ pa,kin ha han səp fun tsau ten it ha tsaŋ loi hi
27,tʂˈɻ̩ lə fan tsai tɕˈy ɕiŋ ma,tsˈɹ̩ no fan tsai tɕˈie iau te pu,txˈɹ̩ əu fan tɕiaŋ tɛ tɕˈi xa,tɕˈiɑʔ liɛu fan tsai tɕˈie hɑu po,tsiaʔ pa tsiaʔ kˈi ho bo,tsˈəʔ lau fæ̃ tsai tɕˈy ɕiəŋ lau va,sik tsɔ fan sin tsi høy hou ma,tɕˈiɒ tɒ ɸan tsai tɕˈie haɯ pu,fã tʂˈɻ̩ pa liɔ tsɛ tɕˈj xɔ tʂuə̃ lia,tɕˈiəʔ kʊ fæ̃ tsɤ tsˈɥ kˈə xɔ,sət te fan tsaŋ hi hau mo
28,man mar tʂˈɻ̩ pa pəŋ tʂɑu tɕi,man mər tsˈɹ̩ pu iau xuaŋ,man man lɛ tsˈɹ̩ xao pu piao tso tɕi,man man tsɹ̩ tɕˈiɑʔ hɑ pɨʔ iɛu tɕiʔ,un un a tsiaʔ bian tioʔ kip,mæ̃ ɕiar tsˈəʔ pəʔ kæ̃ tsəʔ tɕiəʔ,man man sik a m hou kɐp,man tiẽ tɕˈiɒ mo tʂˈo tɕi,m̃ mã ɛ tʂˈɻ̩ pɔ tɕj sa,mæ̃ xɔ tɕˈiəʔ pəʔ iɔ tʂuɐʔ tɕiəʔ,man man ne sət m sɹ̩ an kip
29,tsuo tʂə tʂˈɻ̩ pi tʂan tʂə tʂˈɻ̩ xau tiar,tso tau tɕˈi tsˈɹ̩ pi tsan tau tɕˈi tsˈɹ̩xau ɕi,tso tɕˈi tsˈɹ̩ iao pi tsan tɕˈi tsˈɹ̩ xao tɛ,tsˈo tɑu tɕˈiɑʔ pi tɕˈi tɑu tɕˈiɑʔ hɑu ɕiɛʔ,tse te tsiaʔ pˈin kˈia te tsiaʔ kˈa ho se,tsuɤ təʔ tsˈəʔ pi tsæ̃ təʔ tsˈəʔ xau ɕiar,tsˈɔ tsy sik hou kwɔ kˈei tsy sik,dzo tɒ tɕˈiɒ pi tsan tɒ tɕˈiɒ haɯ sie,tsu xa liɔ tʂˈɻ̩ xɔ pj tsã tʂɔ tʂˈɻ̩ xɔ ɛ ɕi,tsʊ tɔ tɕˈiəʔ pɹ̩ tʂæ̃ tɔ tɕˈiəʔ xɔ sɹ̩,tsˈo ten loi sət pi kˈi ten loi sət kuo hau
30,tˈa tʂˈɻ̩ lə fan lə ni tʂˈɻ̩ mei tsˈɻ̩,tˈa tsˈɹ̩ no fan no ɲi tsˈɹ̩ no fan mei iəu,la tsˈɹ̩ ao fan əu li tsˈɹ̩ ao fan pu tɛ ɛ,tɕie tɕˈiɑʔ liɛu fan ko n̩ tɕˈiɑʔ liɛu fan po,i tsiaʔ pa lo li tsiaʔ pŋ̩ be,tˈa tsˈəʔ lau fæ̃ lie ni tsˈəʔ lie məʔ la,kˈøy sik tsɔ fan lak nei sik tsɔ fan mei nɛ,tˈɒ tɕˈiɒ kɒ ɸan tɒ ɲi tɕˈiɒ kɒ ɸan maɯ,tɕia fã tʂˈɻ̩ pa liɔ ɲi tʂˈɻ̩ liɔ mɔ,tˈa tɕˈiəʔ kʊ fæ̃ lə li kˈə tɕˈiəʔ kʊ tʂə,ki sət le fan ne n sət le fan mo a
31,tˈa tɕˈy kuo ʂɑŋ xai uo mei tɕˈy kuo,tˈa tɕˈie ko saŋ xai ŋo mei tɕˈie ko,la kˈi ko saŋ xai ŋo mei tɛ tɕˈi ko,tɕie tɕˈie kuo sɔŋ hai ŋo mɑu tɕˈie kuo,i kˈi kue sioŋ hai gua bo kˈi kue,tˈa tɕˈy kuɤ sɒ̃ xai ɣɤ məʔ la tɕˈy kuɤ,kˈøy høy kwɔ sœŋ hɔi ŋɔ mei høy kwɔ,tˈɒ taɯ ku ʂɔn hai ŋo maɯ taɯ ku,tɕia ʂɔ̃ xɛ tɕˈj ku nɔ xɛ mɔ tɕˈj ku,tˈa tɔ kʊ ʂɑ̃ xɤ ʊ mɐʔ iɯ tɔ kʊ,ki hi kuo soŋ hoi ŋai m̩ tˈien hi kuo
32,lai uən uən tʂei tuo xuar ɕiɑŋ pu ɕiɑŋ,nai uən xa tsɹ̩ tse to xua ɕiaŋ pu ɕiaŋ,lai uen xa kˈan tsɹ̩ to xua ɕiaŋ pu ɕiaŋ,lai ɕiuŋ ŋɑ kˈɵn kei to fɑ ɕiɔŋ po,lai pˈi kˈuã tsit lui hue u pˈaŋ bo,lai vəŋ vəŋ tsai xua ɕiɒ̃ pəʔ ɕiɒ̃,lɐi mɐn ha nei tœ fa hœŋ m hœŋ,nai uən i ɦɒ ko to huɒ sian pu,ɲi ku lɛ uə̃ ɛ kɔ tʂɻ̩ j tu xua ɛ ɕiɔ tʂɔ mã mɔ ɕiɔ tʂɔ,lɤ uən uən ti tʊ xua kˈə ɕiɑ̃,n̩ loi pˈi it ha e to fa hioŋ mo
33,kei uo pər ʂu,ke ŋo i pən su,la i pen su ken ŋo,lɑʔ ŋo iʔ pɨn ɕy,ho gua tsit pun tsu,kei ɣɤ iəʔ pəŋ su,pei pun sy ŋɔ,pɒ pən ɕy pɒ ŋo,kɨ nɔ kɨ j pə̃ ɛ fv̩,ke ʊ iəʔ pən ʂu,pun it pun su pun ŋai
34,uo tʂən tə mei nei pər ʂu ia,ŋo ŋən sɹ̩ mo te na pən su,ŋo tsen lɛ mei tɛ a pen su ma,ŋo tsɨn ko mɑu iu he pɨn ɕye,gua kˈak sit bo hit pun tsu,ɣɤ tsəŋ təʔ məʔ la vai su,ŋɔ tsɐn hɐi mou kɔ pun sy a,ŋo tʂən ti maɯ tæ nɒ pən ɕy nie,nɔ ʂɻ̩ xua mɔ iɯ nɛ j pə̃ ɛ fv̩ ɔ̃ kˈɔ,ʊ tʂən tiəʔ mɐʔ iɯ la pən ʂu,ŋai mo e pun su ŋai tsən tsən mo e
35,ni kɑu suŋ tˈa,ɲi kən tˈa so,li ken la tɕiaŋ,n̩ kɑu suŋ tɕie,li ka i kɔŋ,ni kau kei tˈa,nei wa pei kˈøy tsi,ɲi kaɯ sɹ̩ tˈɒ,ɲi kɨ tɕia fɔ kɨ j kua,li kən tˈa tɕiɑ̃,n̩ vˈa ki ti
36,xɑu xɑur tə tspi piɛ pˈɑu,xau sən tsəu pu iau pˈau,xao xao lɛ tsəu pu iao pˈao,hɑu sɑŋ tsɹ̩ tsɛu mɔʔ pˈɑu,ho ho a kiã m̩ tˈaŋ tsau,xau xau tsəu pəʔ kæ̃ pˈau,hou sɛŋ haŋ m hou tsɐu,haɯ tiẽ tsəɯ mo bən,xɔ xɔ ɛ tsɯ pɔ pˈɔ,xɔ xɔ tsɯ pəʔ iɔ pˈɔ,man man ne tseu m̩ hau lon tsˈiak
37,ɕiɑu ɕin ʂuai ɕia tɕˈi pˈa pu ʂɑŋ lai,ɕiau ɕin pan tau no pˈa pu tɕˈi nai,pu tsu i ta ɕia tɕˈi təu pˈa pu tɕˈi lai əu,tsɛu fu taʔ hɑ tɕˈie pˈɑ pɨʔ sɔŋ lai,se li puaʔ loʔ kˈi tioʔ pe bue kˈi lai,tsˈau ɕiəŋ tiəʔ xa kəʔ pˈa pəʔ sɒ̃ lai,ku tsy tit lɔk høy pˈa m fan sœŋ lɐi,niəɯ ʂən pan ɦɒ tɕˈie bɒ pu tɕˈi nai,ɕiɔ ɕiə̃ tʂɔ ti ɔ̃ xa tɕˈj pˈa pv̩ ʂɔ̃ lɛ,ɕiɔ ɕin tiɔ ɕia tsˈɥ pˈa pəʔ ʂɑ̃ lɤ,lau sən no tiet ha hi pˈa m̩ soŋ loi vo
38,i ʂəŋ tɕiɑu ni tuo ʂuei xuər,i sən xan ɲi to suei xər ,i sen xan li to suei xa,i sɛn tɕiɛu n̩ to kˈun nɑ tsɹ̩,i siŋ kio li ke kˈun tsit le,tai fu tɕiau ni tɤ suei kəʔ iəʔ tsəŋ tsəŋ,ji sɐŋ kiu nei fɐn tɔ ti,i siẽ iaɯ ɲi to kˈuan i ɦɒ,tɛ fv̩ fɔ tʂɛ tɕiɔ ɲi tu fɨ j xuɨ ɛ fɔ,zɹ̩ sən tɕiɔ li tʊ ʂue ʂue,i sen ham n̩ to soi tit muk
39,tʂˈou ian xɤ tʂˈa tou pu ɕy,tsˈɹ̩ ian tsˈɹ̩ tsˈa təu pu tsuən,tsˈɹ̩ ian tsˈɹ̩ tsˈa təu iao pu tɛ,tɕˈiɑʔ iɛn tɕˈiɑʔ tsˈɑ tu pɨʔ ɕin,tsiaʔ hun a si lim te loŋ be iŋ,tsəʔ ie xaʔ tsˈa təu pəʔ ɕy,sik jin wak tsɛ jɐm tsˈa tou m tɐk,tɕˈiɒ iẽ ho ʂɻ̩ tɕˈiɒ dzɒ təɯ pu tɕyn,iã i pv̩ tɕiɔ tʂˈɻ̩ kɨ tsˈa i pv̩ tɕiɔ xu kɨ,tɕˈiəʔ iɪ̃ kən xɐʔ tʂˈa tɯ pəʔ sɥ,sət ian fat tsa sət tsˈa tu m̩ tso tet
40,ian iɛ xɑu tʂˈa iɛ xɑu uo tou pu xɑu,ian xo tsˈa ŋo təu pu ɕi xuan,kuan li sɹ̩ ian sɹ̩ tsˈa ŋo təu pu ɕi xuan,iɛn nɑ hɑu tsˈɑ iɑ hɑu ŋo tu pɨʔ ɕi fɵn,hun a ho te a ho gua loŋ bo ai,ie ie xau tsˈa ie xau ɣɤ təu pəʔ tai tɕie,jin jɐu hou tsˈa jɐu hou ŋɔ tou m tsuŋ ji,iẽ iɒ haɯ dzo iɒ haɯ ŋo dəɯ pu ɕi hɔn,iã i pa tsˈa i pa nɔ j kua mɔ xɔ tɔ tʂɔ,iɪ̃ iɤ xɔ tʂˈa iɤ xɔ ʊ tɯ pəʔ sɹ̩ xʊ̃,ian ia hau tsˈa ia hau ŋai tu m̩ hau
41,pu kuan ni tɕˈy pu tɕˈy fan tʂəŋ uo ʂɻ̩ iɑu tçˈy tə,pu kuan ɲi tɕˈie pu tɕˈie xuən suən ŋo sɹ̩ iau tɕˈie ni,kuan li tɕˈi pu tɕˈi əu xuen suen ŋo təu sɹ̩ iao tɕˈi lɛ,pɨʔ kuɵn n̩ tɕˈie pɨʔ tɕˈie uɑŋ tsˈɨʔ ŋo sɹ̩ iɛu tɕˈie ko,m̩ kuan li beʔ kˈi a bo ai kˈi hue tit gua si beʔ kˈi,pəʔ kuæ̃ ni tɕˈy pəʔ tɕˈy fæ̃ tsəŋ ɣɤ iau tɕˈy,m lei nei høy m høy fan tsiŋ ŋɔ hɐi jiu høy kɛ,pu kɔn ɲi tɕˈie pu tɕˈie ɸən tʂˈɻ̩ ŋo ʂɻ̩ iaɯ tɕˈie ti,ɲi tɕˈj l̩ mã pv̩ tɕˈj xɔ nɔ fã tʂə̃ tɕˈj lia,kʊ̃ li tsˈɥ pəʔ tsˈɥ ʊ kɔ tsɹ̩ ʂɻ̩ iɔ tsˈɥ tiəʔ,m̩ kuon n̩ hi ia m̩ hi fan tsən ŋai tsˈiu voi hi
42,uo fei tɕˈy pu kɤ,ŋo tɕiəu sɹ̩ iau tɕˈie,ŋo fei iao kˈei,ŋo pɨʔ tɕˈie pɨʔ ɕin,gua it tiŋ beʔ kˈi,ɣɤ fei tɕˈy pəʔ ɕiəŋ,ŋɔ hɐi jiu høy,ŋo ŋən ɸəi iaɯ tɕˈie,fɔ tʂˈə̃ kɔ sa xɔ a nɔ tɕˈj lia,ʊ fe iɔ tsˈɥ,ŋai tsˈiu oi hi
43,ni ʂɻ̩ nei nian lai tə,ɲi sɹ̩ na i ɲian nai ni,li sɹ̩ la i lian lai lɛ,n̩ sɹ̩ lɑ ɲiɛn tsɹ̩ lai ko,li si to tsit lĩ lai e,ni sɹ̩ na nie lai təʔ,nei hɐi pin jɐt nin lɐi ka,ɲi ʂɻ̩ nɒ i ɲiẽ nai ti,ɲi sɹ̩ a j ɲiã lɛ tsɹ̩,li ʂɻ̩ la iəʔ liɪ̃ lɤ tiəʔ,n̩ he nai ŋian loi ke
44,uo ʂɻ̩ tɕˈian nian lai tə pei tɕiŋ,ŋo sɹ̩ tɕˈian ɲian tsɹ̩ tau pe tɕin ni,ŋo sɹ̩ tɕˈian lian lai pɛ tɕin lɛ,ŋo sɹ̩ tɕˈiɛn ɲiɛn tsɹ̩ tɑu ko pɛʔ tɕin,gua si tsiŋ lĩ kau pak kiã e,ɣɤ sɹ̩ tɕˈie nie tau təʔ pei tɕiəŋ,ŋɔ hɐi tsˈin nin tou pɐk kiŋ kɛ,ŋo ʂɻ̩ dziẽ kɒ ɲiẽ taɯ pæ tɕin ti,nɔ sɹ̩ tɕˈiã ɲiã tɔ xa pɨ tɕiə̃ tsɹ̩,ʊ ʂɻ̩ tɕˈiɪ̃ liɪ̃ tɔ pɐʔ tɕin tiəʔ,ŋai he tsˈien ŋian ne loi pet kin ke
45,tɕiər kˈai xuei ʂei tə tʂu ɕi,tɕˈin tˈian kˈai xuei na ko taŋ tsu ɕi,tɕin tˈian kˈai xuei sɹ̩ la ko taŋ tsu ɕi,tɕin ɲiʔ kˈai fɨi lɑ ko tɔŋ tɕy ɕiʔ,kiã lit kˈui hue siã laŋ tso tsu sik,tɕiəŋ zəʔ kˈai xuei suei təʔ tsu ɕiəʔ,kɐm mɐt hɔi wui pin kɔ tsou tsy tsik,tɕin i tsɹ̩ kˈai ɸəi nɒ ko tsəɯ tɕy si,tɕiə̃ ɛ kˈɛ xuɨ xɔ tʂv̩ ɕj fɨ tɔ̃ tʂɛ,tɕiɤ kə kˈɤ xue xa kə tsʊ tʂu ɕiəʔ,kim pu ŋit kˈoi fi man ŋin toŋ tsu sit
46,ni tei tɕˈiŋ uo tə kˈɤ,tɕˈin kˈe,li iao tɕˈin ŋo lɛ kˈɛ əu,n̩ iɛu tɕˈiɑŋ ŋo ko kɑʔ,li to ai tsˈiã gua,ni tiəʔ tɕˈiəŋ ɣɤ təʔ kˈaʔ,nei jiu tsˈɛŋ ŋɔ sik fan pɔ,ɲi iaɯ tsˈin ŋo tsəɯ kˈæ pai,ɲi ti pa nɔ tɕˈiɔ kɨ j kua,li iɔ tɕˈin ʊ kˈɐʔ,n̩ oi tsˈiaŋ ŋai
47,i piar tsou i piar liɑu,i pian tsəu i pian pai,lian lu tsəu lian lu tɕiaŋ,iʔ piɛn tsɛu iʔ piɛn uɑ,lã kiã lã kɔŋ,iəʔ pie tsəu iəʔ pie suaʔ,jɐt pin haŋ jɐt pin kɔŋ,piẽ tsəɯ piẽ kɔn,ɕyã tsɯ ɕyã fɔ,iəʔ piɪ̃ tsɯ iəʔ piɪ̃ tɕiɑ̃,it pien haŋ it pien koŋ
48,yɛ tsou yɛyan yɛ liau yɛ yɛ tuo,ye tsəu ye yan ye pai ye to,iɛ tsəu iɛ ian iɛ su iɛ to,yɵʔ tsɛu yɵʔ yɵn yɵʔ uɑ yɵʔ to,lu kiã lu hŋ lu kɔŋ lu tse,yəʔ tsəu yəʔ ye yəʔ suaʔ yəʔ tɤ,jyt haŋ jyt jyn jyt kɔŋ jyt tɔ,yæ tsəɯ yæ yẽ yæ kɔn yæ to,yu tsɯ yu yã yu fɔ yu tu,yɐʔ tsɯ yɐʔ yɪ̃ yɐʔ tɕiɑ̃ yɐʔ tʊ,iat tseu iat ian iat koŋ iat to
49,pai nei tuŋ ɕi na kei uo,pa na ko toŋ ɕi na ke ŋo,pa a ko toŋ ɕi la kei ŋo,pɑ he tsɑʔ tuŋ ɕi lɑʔ tɛʔ ŋo,ka hit le bĩʔ kiã tˈeʔ ho gua,pa vai tuəŋ ɕi xɤ kei ɣɤ,tsœŋ kɔ kɔ jɛ lɔ pei ŋɔ,pɒ nɒ tʂɒ tən si nɒ pɒ ŋo,pa nɛ kɔ tuə̃ ɕj kɨ nɔ tɕi kɨ kɔ,pa la kə təŋ sɹ̩ tsə tsɹ̩ ke ʊ,pa ke tsak tuŋ si na pun ŋai
50,iou ɕiɛ kə ti tɕiɛr kuan tˈai iɑŋ tɕiɑu ʐɻ̩ tˈou,iəu ni ti faŋ pa tˈai iaŋ tɕiau tso zɹ̩ tˈəu,iəu ɕiɛ ti faŋ pa tˈai iaŋ tɕiao tsu zɹ̩ tˈəu,iu ɕiɛʔ tˈi foŋ tɕiɛu tˈai iɔŋ tsu ɲiʔ tˈɛu,u e so tsai ka tˈai iɔŋ kio tsue lit tˈau,iəu ɕiar ti fɒ̃ pa iɒ̃ pˈɤ tɕiau zəʔ tˈəu,jɐu ti tei fɔŋ tsœŋ tˈai jœŋ kiu tsou jɐt tˈɐu,iəɯ ti tɔn ʂɔn tɕiaɯ ian tsəɯ i dəɯ,iɯ ɕi tsɹ̩ fɔ̃ pa tˈɛ iɔ̃ tɕiɔ ʐɛ tˈɯ ɛ tʂɛ,iɯ sɹ̩ tsɹ̩ fɑ̃ pa tˈɤ iɑ̃ tɕiɔ ʐəʔ tˈɯ,iu teu tˈi foŋ pa tˈai ioŋ ham tso ŋit tˈeu
51,nin kuei ɕiŋ uo ɕiŋ uɑŋ,ɲi kuei ɕin ŋo ɕin uaŋ,li kuei ɕin ŋo ɕin uaŋ,n̩ kui ɕiɑŋ ŋo ɕiɑŋ uɔŋ,li kui sẽ gua sĩ oŋ,ni kuei ɕiəŋ ɣɤ ɕiəŋ vɒ̃,nei kwɐi siŋ ŋɔ siŋ wɔŋ,n̩ nən kɒ kuəi sin ŋo sin uɔn,ɲi ɕiə̃ sa nɔ ɕiə̃ uɔ̃,li kue ɕin ʊ ɕin uɑ̃,n̩ kui siaŋ ŋa ŋai siaŋ voŋ
52,ni ɕiŋ uɑŋ uo iɛ ɕiŋ uɑŋ tsam lia tou ɕiŋ uɑŋ,ɲi ɕin uaŋ ŋo ie ɕin uaŋ ŋo mən niaŋ ko təu ɕin uaŋ,li ɕin uaŋ ŋo iɛ sɹ̩ ɕin uaŋ ŋo men liaŋ ko təu ɕin uaŋ,n̩ ɕiɑŋ uɔŋ ŋo ɑ ɕiɑŋ uɔŋ ŋo mɨn liɔŋ ko ɲin tu ɕiɑŋ uɔŋ,li sĩ oŋ gua bã sĩ oŋ lan lŋ e laŋ loŋ sĩ oŋ,ni ɕiəŋ vɒ̃ ɣɤ ie ɕiəŋ vɒ̃ tsa lia kɤ təu ɕiəŋ vɒ̃,nei siŋ wɔŋ ŋɔ jik siŋ wɔŋ ŋɔ tei lœŋ kɔ tou siŋ wɔŋ,ɲi iɒ sin uɔn ŋo iɒ sin uɔn ŋo in nian ko in təɯ sin uɔn,ɲi ɕiə̃ uɔ̃ nɔ i ɕiə̃ uɔ̃ nɔ lia j kua ɕiə̃ uɔ̃,li ɕin uɑ̃ ʊ iɤ ɕin uɑ̃ ʊ liɑ̃ kə tɯ ɕin uɑ̃,n̩ siaŋ voŋ ŋai ia siaŋ voŋ ŋai lioŋ ke ŋin tu siaŋ voŋ
53,ni ɕian tɕˈy pa uom tai xuər tsai tɕˈy,ɲi ɕian tɕˈie ma ŋo mən tən xər tɕiəu nai,li ɕian kˈi tao xa ŋo men ten i xa xa tsai kˈɛ,n̩ piɛn tɕˈie lo ŋo ko li tɛn ɑ tsɹ̩ tsai tɕˈie,li siŋ kˈi a gun sio tan le tsiaʔ kˈi,ni ɕie tɕˈy va ɣã məŋ təŋ iəʔ tsəŋ tsəŋ tsai tɕˈy,nei høy sin la ŋɔ tɐŋ jɐt tsɐn sin høy,ɲi siẽ tɕˈie no ŋo in ko i kæ dʑi tsai tɕˈie,ɲi ɕiã tɕˈj sa nɔ mə̃ tə̃ j kua liɔ tsɛ tɕˈj,li tɕˈiɪ̃ tsˈɥ pa ʊ mən tən iəʔ ʂɐʔ tsə tsɤ tsˈɥ,n̩ tso n̩ sien hi ŋai ten ŋin ten it ha tsaŋ hi
54,ni tʂˈou ian pu tʂˈou,ɲi tsˈɹ̩ pu tsˈɹ̩ ian,li tsˈɹ̩ ian pu tsˈɹ̩,n̩ tɕˈiɑʔ iɛn po,li u tsiaʔ hun bo,ni tsˈəʔ ie lɤ pəʔ,nei sik m sik jin,ɲi tɕˈiɒ iẽ pu,ɲi iã tʂˈɻ̩ l̩ pɔ̃,li kˈə tɕˈiəʔ iɪ̃,n̩ sət ian mo
55,ni ʐən tə nei kə ʐən pu ʐən tə,ɲi zən pu zən te tau na ko zən,li zen tɛ a ko zen pu,n̩ ɲin tɛʔ he ko ɲin po,lu u siʔ sai hit le laŋ bo,ni zəŋ tiəʔ vai zəŋ lɤ pəʔ,nei jiŋ m jiŋ tɐk kɔ kɔ jɐn,ɲi in tæ nɒ tʂɒ in pu,nɛ kɔ ʐə̃ ɲi ʐə ti l̩ pɔ̃,li kˈə ʐən tɐʔ la kə ʐən,n̩ sət tet ke tsak ŋin mo
