dialect_id,dialect_name,sentence_id,meaning,othography,english,ipa_no_tone,ipa_with_tone,ipa_converted_no_tone,ipa_converted_with_tone
GY,Guiyang,1,有一回,有一回,,iəu i xuei,iəu42 i21 xuei21,iəuixuei,iəu42i21xuei21
GY,Guiyang,2,北风跟太阳在那儿争论谁的本事大,北风同太阳在那点争哪个的本事大,,pɛ foŋ tˈoŋ tˈai iaŋ tsai a tɛ tsen la ko lɛ pen sɿ ta,pɛ21 foŋ55 tˈoŋ21 tˈai213 iaŋ21 tsai213 a213 tɛ42 tsen55 la42 ko213 lɛ55 pen42 sɿ213 ta213,pɛfoŋtʰoŋtʰaiiaŋtsaiatɛtsenlakolɛpensɹ̩ta,pɛ21foŋ55tʰoŋ21tʰai213iaŋ21tsai213a213tɛ42tsen55la42ko213lɛ55pen42sɹ̩213ta213
GY,Guiyang,3,争来争去就是分不出高低来,争来争去就是分不出高低长短来,,tsen lai tsen tɕˈɛ təu sɿ fen pu tsˈu kao ti tsˈaŋ tuan lai,tsen55 lai21 tsen55 tɕˈɛ213 təu213 sɿ213 fen55 pu21 tsˈu21 kao55 ti55 tsˈaŋ21 tuan42 lai21,tsenlaitsentɕʰɛtəusɹ̩fenputsʰukaotitsʰaŋtuanlai,tsen55lai21tsen55tɕʰɛ213təu213sɹ̩213fen55pu21tsʰu21kao55ti55tsʰaŋ21tuan42lai21
GY,Guiyang,4,这时候路上来了个走道儿的,正在这个时候路上来了个走路的,,tsen tsai tsɿ ko sɿ xəu lu saŋ lai la ko tsəu lu lɛ,tsen213 tsai213 tsɿ55 ko213 sɿ21 xəu55 lu213 saŋ213 lai21 la42 ko213 tsəu42 lu213 lɛ55,tsentsaitsɹ̩kosɹ̩xəulusaŋlailakotsəululɛ,tsen213tsai213tsɹ̩55ko213sɹ̩21xəu55lu213saŋ213lai21la42ko213tsəu42lu213lɛ55
GY,Guiyang,5,他身上穿着件厚大衣,他身上穿起件厚大衣,,la sen saŋ tsˈuan tɕˈi tɕian xəu ta i,la55 sen55 saŋ213 tsˈuan55 tɕˈi42 tɕian213 xəu213 ta213 i55,lasensaŋtsʰuantɕʰitɕianxəutai,la55sen55saŋ213tsʰuan55tɕʰi42tɕian213xəu213ta213i55
GY,Guiyang,6,他们俩就说好了,他们两个就说好,,la men liaŋ ko təu so xao,la55 men55 liaŋ42 ko213 təu213 so21 xao42,lamenliaŋkotəusoxao,la55men55liaŋ42ko213təu213so21xao42
GY,Guiyang,7,谁能先叫这个走道儿的脱下他的厚大衣,哪个先叫这个走路的脱下他的厚大衣来,,la ko ɕiaŋ tɕiao tsɿ ko tsəu lu lɛ tˈo ɕia la lɛ xəu ta i lai,la42 ko213 ɕiaŋ55 tɕiao213 tsɿ55 ko213 tsəu42 lu213 lɛ55 tˈo21 ɕia213 la55 lɛ55 xəu213 ta213 i55 lai21,lakoɕiaŋtɕiaotsɹ̩kotsəululɛtʰoɕialalɛxəutailai,la42ko213ɕiaŋ55tɕiao213tsɹ̩55ko213tsəu42lu213lɛ55tʰo21ɕia213la55lɛ55xəu213ta213i55lai21
GY,Guiyang,8,就算谁的本事大,就算哪个的本事大,,tɕiu suan la ko lɛ pen sɿ ta,tɕiu213 suan213 la42 ko213 lɛ55 pen42 sɿ213 ta213,tɕiusuanlakolɛpensɹ̩ta,tɕiu213suan213la42ko213lɛ55pen42sɹ̩213ta213
GY,Guiyang,9,北风就使劲儿地刮起来了,北风就展劲展劲的吹起来,,pɛ foŋ təu tsan tɕin tsan tɕin lɛ tsˈuei tɕˈi lai,pɛ21 foŋ55 təu213 tsan42 tɕin213 tsan42 tɕin213 lɛ55 tsˈuei55 tɕˈi42 lai21,pɛfoŋtəutsantɕintsantɕinlɛtsʰueitɕʰilai,pɛ21foŋ55təu213tsan42tɕin213tsan42tɕin213lɛ55tsʰuei55tɕʰi42lai21
GY,Guiyang,10,不过他越是刮得厉害,但不过是他吹得越凶,,tan pu ko sɿ la tsˈuei tɛ iɛ ɕioŋ,tan213 pu21 ko213 sɿ213 la55 tsˈuei55 tɛ21 iɛ21 ɕioŋ55,tanpukosɹ̩latsʰueitɛiɛɕioŋ,tan213pu21ko213sɹ̩213la55tsʰuei55tɛ21iɛ21ɕioŋ55
GY,Guiyang,11,那个走道儿的把大衣裹得越紧,那个走路的把大衣裹得越紧,,a ko tsəu lu lɛ pa ta i ko tɛ iɛ tɕin,a213 ko213 tsəu42 lu213 lɛ55 pa42 ta213 i55 ko42 tɛ21 iɛ21 tɕin42,akotsəululɛpataikotɛiɛtɕin,a213ko213tsəu42lu213lɛ55pa42ta213i55ko42tɛ21iɛ21tɕin42
GY,Guiyang,12,后来北风没法儿了,赶后北风没得办法了,,kan xəu pɛ foŋ mei tɛ pan fa la,kan42 xəu213 pɛ21 foŋ55 mei55 tɛ21 pan213 fa21 la42,kanxəupɛfoŋmeitɛpanfala,kan42xəu213pɛ21foŋ55mei55tɛ21pan213fa21la42
GY,Guiyang,13,只好就算了,就只好算啦,,təuɿ tsɿ xao suan la,təu213ɿ tsɿ42 xao42 suan213 la42,təuɹ̩tsɹ̩xaosuanla,təu213ɹ̩tsɹ̩42xao42suan213la42
GY,Guiyang,14,过了一会儿,过了一下下,,ko ao i xa xa,ko213 ao213 i21 xa55 xa55,koaoixaxa,ko213ao213i21xa55xa55
GY,Guiyang,15,太阳出来了,太阳就出来啰,,tˈai iaŋ təu tsˈu lai lo,tˈai21 iaŋ21 təu213 tsˈu21 lai21 lo42,tʰaiiaŋtəutsʰulailo,tʰai21iaŋ21təu213tsʰu21lai21lo42
GY,Guiyang,16,他火辣辣地一晒,他热哄哄的一晒,,la zɛ xoŋ xoŋ lɛ i sai,la55 zɛ21 xoŋ42 xoŋ42 lɛ55 i21 sai213,lazɛxoŋxoŋlɛisai,la55zɛ21xoŋ42xoŋ42lɛ55i21sai213
GY,Guiyang,17,那个走道儿的马上就把那件厚大衣脱下来了,那个走路的立马就把那件厚大衣脱下啦,,a ko tsəu lu lɛ li ma təu pa a tɕian xəu ta i tˈo ɕia lai la,a213 ko213 tsəu42 lu213 lɛ55 li21 ma42 təu213 pa42 a213 tɕian213 xəu213 ta213 i55 tˈo21 ɕia213 lai21 la42,akotsəululɛlimatəupaatɕianxəutaitʰoɕialaila,a213ko213tsəu42lu213lɛ55li21ma42təu213pa42a213tɕian213xəu213ta213i55tʰo21ɕia213lai21la42
GY,Guiyang,18,这下北风只好承认,这回北风只好承认,,tsɿ xuei pɛ foŋ tsɿ xao tsˈen zen,tsɿ55 xuei21 pɛ21 foŋ55 tsɿ42 xao42 tsˈen21 zen213,tsɹ̩xueipɛfoŋtsɹ̩xaotsʰenzen,tsɹ̩55xuei21pɛ21foŋ55tsɹ̩42xao42tsʰen21zen213
GY,Guiyang,19,他们俩当中还是太阳的本事大,他们两个中间还是太阳的本事大,,la men liaŋ ko tsoŋ tɕian xai sɿ tˈai iaŋ lɛ pen sɿ ta,la55 men55 liaŋ42 ko213 tsoŋ55 tɕian55 xai21 sɿ213 tˈai213 iaŋ21 lɛ55 pen42 sɿ213 ta213,lamenliaŋkotsoŋtɕianxaisɹ̩tʰaiiaŋlɛpensɹ̩ta,la55men55liaŋ42ko213tsoŋ55tɕian55xai21sɹ̩213tʰai213iaŋ21lɛ55pen42sɹ̩213ta213
