dialect_id,dialect_name,sentence_id,meaning,othography,english,ipa_no_tone,ipa_with_tone,ipa_converted_no_tone,ipa_converted_with_tone
XT,Xiangtan,1,谁啊?我是老三。,哪个?我是老三,,nɒ ko ŋo ʂʅ naɯ san,nɒ42 ko55 ŋo42 ʂʅ21 naɯ42 san33,nɒkoŋoʂɻ̩naɯsan,nɒ42ko55ŋo42ʂɻ̩21naɯ42san33
XT,Xiangtan,2,老四呢?她正跟一个朋友说着话呢。,老四呢?她正在和一隻朋友打太平讲,,naɯ sʅ nie tɒ tʂən dzai ɦo i tʂo pˈən iəɯ tɒ tˈai bian kɔn,naɯ42 sʅ55 nie55 tɒ33 tʂən55 dzai21 ɦo12 i24 tʂo24 pˈən12 iəɯ42 tɒ42 tˈai55 bian12 kɔn42,naɯsɻ̩nietɒtʂəndzaiɦoitʂopʰəniəɯtɒtʰaibiankɔn,naɯ42sɻ̩55nie55tɒ33tʂən55dzai21ɦo12i24tʂo24pʰən12iəɯ42tɒ42tʰai55bian12kɔn42
XT,Xiangtan,3,她还没说完吗?,她还冒讲完啵,,tɒ ɦai maɯ kɔn yẽ po,tɒ33 ɦai12 maɯ21 kɔn42 yẽ12 po55,tɒɦaimaɯkɔnyẽpo,tɒ33ɦai12maɯ21kɔn42yẽ12po55
XT,Xiangtan,4,还没有。大概再有一会儿就说完了。,还冒。大概再讲一阵子就讲完哒,,ɦai maɯ dai kˈai tsai kɔn i tsən tsɿ dʑiəɯ kɔn yẽ tɒ,ɦai maɯ21 dai21 kˈai55 tsai55 kɔn42 i24 tsən21 tsɿ33 dʑiəɯ21 kɔn42 yẽ12 tɒ42,ɦaimaɯdaikʰaitsaikɔnitsəntsɹ̩dʑiəɯkɔnyẽtɒ,ɦaimaɯ21dai21kʰai55tsai55kɔn42i24tsən21tsɹ̩33dʑiəɯ21kɔn42yẽ12tɒ42
XT,Xiangtan,5,他说马上就走，怎么这半天了还在家里?,他讲随即就走，台的解咯么半天哒还在屋里,,tɒ kɔn səi tɕi dʑiəɯ tsəɯ i ti kai ko mo pɔn tˈiẽ tɒ ɦai dzai u ni,tɒ33 kɔn42 səi12 tɕi24 dʑiəɯ21 tsəɯ42 i12 ti33 kai42 ko24 mo42 pɔn55 tˈiẽ33 tɒ42 ɦai12 dzai21 u24 ni42,tɒkɔnsəitɕidʑiəɯtsəɯitikaikomopɔntʰiẽtɒɦaidzaiuni,tɒ33kɔn42səi12tɕi24dʑiəɯ21tsəɯ42i12ti33kai42ko24mo42pɔn55tʰiẽ33tɒ42ɦai12dzai21u24ni42
XT,Xiangtan,6,你到哪儿去?我到城里去。,你到哪当去?我到城里去,,ȵi taɯ nɒ tɔn tɕˈie ŋo taɯ dʐən ni tɕˈie,ȵi42 taɯ55 nɒ42 tɔn55 tɕˈie55 ŋo42 taɯ55 dʐən12 ni42 tɕˈie55,ɲitaɯnɒtɔntɕʰieŋotaɯdʐənnitɕʰie,ɲi42taɯ55nɒ42tɔn55tɕʰie55ŋo42taɯ55dʐən12ni42tɕʰie55
XT,Xiangtan,7,在那儿，不在这儿。,在那当，冒在咯当,,dzai nɒ tɔn maɯ dzai ko tɔn,dzai21 nɒ24 tɔn55 maɯ21 dzai21 ko24 tɔn55,dzainɒtɔnmaɯdzaikotɔn,dzai21nɒ24tɔn55maɯ21dzai21ko24tɔn55
XT,Xiangtan,8,不是那么做，要这么做。,不是那么做，要这么做,,pu ʂʅ iaɯ nɒ ian tsəɯ ʂʅ iaɯ ko ian tsəɯ,pu24 ʂʅ21 iaɯ55 nɒ24 ian21 tsəɯ55 ʂʅ iaɯ55 ko24 ian21 tsəɯ55,puʂɻ̩iaɯnɒiantsəɯʂɻ̩iaɯkoiantsəɯ,pu24ʂɻ̩21iaɯ55nɒ24ian21tsəɯ55ʂɻ̩iaɯ55ko24ian21tsəɯ55
XT,Xiangtan,9,太多了，用不着那么多，只要这么多就够了。,太多哒，要不了那样多，只要咯样多就有哒,,tˈai to tɒ iaɯ pu niaɯ nɒ ian to tʂʅ iaɯ ko ian to dziəɯ iəɯ tɒ,tˈai55 to33 tɒ42 iaɯ55 pu24 niaɯ42 nɒ24 ian21 to33 tʂʅ24 iaɯ55 ko24 ian21 to33 dziəɯ21 iəɯ42 tɒ42,tʰaitotɒiaɯpuniaɯnɒiantotʂɻ̩iaɯkoiantodziəɯiəɯtɒ,tʰai55to33tɒ42iaɯ55pu24niaɯ42nɒ24ian21to33tʂɻ̩24iaɯ55ko24ian21to33dziəɯ21iəɯ42tɒ42
XT,Xiangtan,10,这个大，那个小，这两个哪一个好一点呢?,咯隻大，那隻小，咯两隻哪一隻好一点,,ko tʂɒ dai nɒ tʂɒ siaɯ ko nian tʂo nɒ i tʂo haɯ i tiẽ,ko24 tʂɒ24 dai21 nɒ24 tʂɒ24 siaɯ42 ko24 nian42 tʂo24 nɒ42 i24 tʂo24 haɯ42 i24 tiẽ42,kotʂɒdainɒtʂɒsiaɯkoniantʂonɒitʂohaɯitiẽ,ko24tʂɒ24dai21nɒ24tʂɒ24siaɯ42ko24nian42tʂo24nɒ42i24tʂo24haɯ42i24tiẽ42
XT,Xiangtan,11,这个比那个好。,咯隻比那隻好,,ko tʂo pi nɒ tʂo haɯ,ko24 tʂo24 pi42 nɒ24 tʂo24 haɯ42,kotʂopinɒtʂohaɯ,ko24tʂo24pi42nɒ24tʂo24haɯ42
XT,Xiangtan,12,这些房子不如那些房子好。,咯些房子不比那些房子好,,ko xie ɦɔn tsɿ pu pi nɒ sie ɦɔn tsɿ haɯ,ko24 xie33 ɦɔn12 tsɿ33 pu24 pi42 nɒ24 sie33 ɦɔn12 tsɿ33 haɯ42,koxieɦɔntsɹ̩pupinɒsieɦɔntsɹ̩haɯ,ko24xie33ɦɔn12tsɹ̩33pu24pi42nɒ24sie33ɦɔn12tsɹ̩33haɯ42
XT,Xiangtan,13,这句话用XX话怎么说?,,,,,,
XT,Xiangtan,14,他今年多大岁数了?,他今年好多岁哒,,tˈɒ tɕin ȵiẽ haɯ to səi tɒ,tˈɒ33 tɕin33 ȵiẽ12 haɯ42 to33 səi55 tɒ42,tʰɒtɕinɲiẽhaɯtosəitɒ,tʰɒ33tɕin33ɲiẽ12haɯ42to33səi55tɒ42
XT,Xiangtan,15,大概三十来岁吧。,约摸三十出点头㗑,,io mo san ʂɿ tɕˈy tiẽ dəɯ pai,io24 mo33 san33 ʂɿ55 tɕˈy24 tiẽ42 dəɯ12 pai42,iomosanʂɹ̩tɕʰytiẽdəɯpai,io24mo33san33ʂɹ̩55tɕʰy24tiẽ42dəɯ12pai42
XT,Xiangtan,16,这个东西有多重呢?,咯隻东西有好重咧,,ko tʂɒ tən si iəɯ haɯ dʐən nie,ko24 tʂɒ24 tən33 si33 iəɯ42 haɯ42 dʐən21 nie55,kotʂɒtənsiiəɯhaɯdʐənnie,ko24tʂɒ24tən33si33iəɯ42haɯ42dʐən21nie55
XT,Xiangtan,17,有五十斤重呢。,有五十斤重,,iəɯ ɯ ʂʅ tɕin dʐən,iəɯ42 ɯ42 ʂʅ55 tɕin33 dʐən21,iəɯɯʂɻ̩tɕindʐən,iəɯ42ɯ42ʂɻ̩55tɕin33dʐən21
XT,Xiangtan,18,拿得动吗?,拿得起不,,nɒ tæ tɕˈi pu,nɒ33 tæ24 tɕˈi42 pu24,nɒtætɕʰipu,nɒ33tæ24tɕʰi42pu24
XT,Xiangtan,19,我拿得动，他拿不动。,我拿得起，他拿不起,,ŋo nɒ tæ tɕˈi tˈɒ nɒ pu tɕˈi,ŋo42 nɒ33 tæ24 tɕˈi42 tˈɒ33 nɒ33 pu24 tɕˈi42,ŋonɒtætɕʰitʰɒnɒputɕʰi,ŋo42nɒ33tæ24tɕʰi42tʰɒ33nɒ33pu24tɕʰi42
XT,Xiangtan,20,真不轻，重得连我也拿不动。,真正不轻，重得到我都拿不起,,tsən tʂən pu tɕˈin dʐən tæ taɯ ŋo təɯ nɒ pu tɕˈi,tsən33 tʂən55 pu24 tɕˈin33 dʐən21 tæ24 taɯ55 ŋo42 təɯ33 nɒ33 pu24 tɕˈi42,tsəntʂənputɕʰindʐəntætaɯŋotəɯnɒputɕʰi,tsən33tʂən55pu24tɕʰin33dʐən21tæ24taɯ55ŋo42təɯ33nɒ33pu24tɕʰi42
XT,Xiangtan,21,你说得很好，你还会说点什么呢?,你讲得蛮好，你还晓得讲点什么呢,,ȵi kɔn tæ man haɯ ȵi ɦai ɕiaɯ tæ kɔn tiẽ ʂən mo nie,ȵi42 kɔn42 tæ24 man12 haɯ42 ȵi42 ɦai12 ɕiaɯ42 tæ24 kɔn42 tiẽ55 ʂən55 mo42 nie55,ɲikɔntæmanhaɯɲiɦaiɕiaɯtækɔntiẽʂənmonie,ɲi42kɔn42tæ24man12haɯ42ɲi42ɦai12ɕiaɯ42tæ24kɔn42tiẽ55ʂən55mo42nie55
XT,Xiangtan,22,我嘴笨，我说不过他。,我嘴巴木，我讲他不过,,ŋo tsəi pɒ mo ŋ kɔn tˈɒ pu ku,ŋo42 tsəi42 pɒ33 mo24 ŋ042 kɔn42 tˈɒ33 pu24 ku55,ŋotsəipɒmoŋkɔntʰɒpuku,ŋo42tsəi42pɒ33mo24ŋ042kɔn42tʰɒ33pu24ku55
XT,Xiangtan,23,说了一遍，又说一遍。,讲哒一道，又讲一道,,kɔn tɒ i taɯ iəɯ kɔn i taɯ,kɔn42 tɒ42 i24 taɯ55 iəɯ21 kɔn42 i24 taɯ55,kɔntɒitaɯiəɯkɔnitaɯ,kɔn42tɒ42i24taɯ55iəɯ21kɔn42i24taɯ55
XT,Xiangtan,24,请你再说一遍。,请你再讲一道,,tsˈian ȵi tsai kɔn i taɯ,tsˈian42 ȵi42 tsai55 kɔn42 i24 taɯ55,tsʰianɲitsaikɔnitaɯ,tsʰian42ɲi42tsai55kɔn42i24taɯ55
XT,Xiangtan,25,不早了，快去吧。,晏咖哒，快点去啰,,ŋan kɒ tɒ kˈuai tiẽ tɕˈie no,ŋan55 kɒ55 tɒ42 kˈuai55 tiẽ42 tɕˈie55 no21,ŋankɒtɒkʰuaitiẽtɕʰieno,ŋan55kɒ55tɒ42kʰuai55tiẽ42tɕʰie55no21
XT,Xiangtan,26,现在还早着呢，等一会儿再去吧。,咯时也还早哒，过一刻唧再去,,ko ʂʅ sʅ ɦai tsaɯ tɒ ku i kˈæ dʑi tsai tɕˈie,ko24 ʂʅ12 sʅ55 ɦai12 tsaɯ42 tɒ42 ku55 i24 kˈæ24 dʑi21 tsai55 tɕˈie55,koʂɻ̩sɻ̩ɦaitsaɯtɒkuikʰædʑitsaitɕʰie,ko24ʂɻ̩12sɻ̩55ɦai12tsaɯ42tɒ42ku55i24kʰæ24dʑi21tsai55tɕʰie55
XT,Xiangtan,27,吃了饭再去好吗?,吃哒饭再去好不,,tɕˈiɒ tɒ ɸan tsai tɕˈie haɯ pu,tɕˈiɒ24 tɒ42 ɸan21 tsai55 tɕˈie55 haɯ42 pu24,tɕʰiɒtɒɸantsaitɕʰiehaɯpu,tɕʰiɒ24tɒ42ɸan21tsai55tɕʰie55haɯ42pu24
XT,Xiangtan,28,慢慢儿吃啊，不要着急。,慢点吃，莫着急,,man tiẽ tɕˈiɒ mo tʂˈo tɕi,man21 tiẽ55 tɕˈiɒ24 mo24 tʂˈo24 tɕi24,mantiẽtɕʰiɒmotʂʰotɕi,man21tiẽ55tɕʰiɒ24mo24tʂʰo24tɕi24
XT,Xiangtan,29,坐着吃比站着吃好些。,坐哒吃比站哒吃好些,,dzo tɒ tɕˈiɒ pi tsan tɒ tɕˈiɒ haɯ sie,dzo21 tɒ42 tɕˈiɒ24 pi42 tsan55 tɒ42 tɕˈiɒ24 haɯ42 sie33,dzotɒtɕʰiɒpitsantɒtɕʰiɒhaɯsie,dzo21tɒ42tɕʰiɒ24pi42tsan55tɒ42tɕʰiɒ24haɯ42sie33
XT,Xiangtan,30,他吃了饭了，你吃了饭没有呢?,他吃介饭哒，你吃介饭冒,,tˈɒ tɕˈiɒ kɒ ɸan tɒ ȵi tɕˈiɒ kɒ ɸan maɯ,tˈɒ33 tɕˈiɒ24 kɒ55 ɸan21 tɒ42 ȵi42 tɕˈiɒ24 kɒ55 ɸan21 maɯ21,tʰɒtɕʰiɒkɒɸantɒɲitɕʰiɒkɒɸanmaɯ,tʰɒ33tɕʰiɒ24kɒ55ɸan21tɒ42ɲi42tɕʰiɒ24kɒ55ɸan21maɯ21
XT,Xiangtan,31,他去过上海，我没有去过。,他到过上海，我冒到过,,tˈɒ taɯ ku ʂɔn hai ŋo maɯ taɯ ku,tˈɒ33 taɯ55 ku55 ʂɔn21 hai42 ŋo42 maɯ21 taɯ55 ku55,tʰɒtaɯkuʂɔnhaiŋomaɯtaɯku,tʰɒ33taɯ55ku55ʂɔn21hai42ŋo42maɯ21taɯ55ku55
XT,Xiangtan,32,来闻闻这朵花香不香。,来闻一下咯朵花香不,,nai uən i ɦɒ ko to huɒ sian pu,nai12 uən12 i24 ɦɒ21 ko24 to42 huɒ33 sian33 pu55,naiuəniɦɒkotohuɒsianpu,nai12uən12i24ɦɒ21ko24to42huɒ33sian33pu55
XT,Xiangtan,33,给我一本书。,把本书把我,,pɒ pən ɕy pɒ ŋo,pɒ42 pən42 ɕy33 pɒ42 ŋo42,pɒpənɕypɒŋo,pɒ42pən42ɕy33pɒ42ŋo42
XT,Xiangtan,34,我真的没有那本书呀。,我真的冒得那本书咧,,ŋo tʂən ti maɯ tæ nɒ pən ɕy nie,ŋo42 tʂən33 ti33 maɯ21 tæ24 nɒ24 pən42 ɕy33 nie33,ŋotʂəntimaɯtænɒpənɕynie,ŋo42tʂən33ti33maɯ21tæ24nɒ24pən42ɕy33nie33
XT,Xiangtan,35,你告诉他。,你告诉他,,ȵi kaɯ sɿ tˈɒ,ȵi42 kaɯ55 sɿ55 tˈɒ33,ɲikaɯsɹ̩tʰɒ,ɲi42kaɯ55sɹ̩55tʰɒ33
XT,Xiangtan,36,好好地走，不要跑。,好点走，莫蹦,,haɯ tiẽ tsəɯ mo bən,haɯ42 tiẽ55 tsəɯ42 mo24 bən12,haɯtiẽtsəɯmobən,haɯ42tiẽ55tsəɯ42mo24bən12
XT,Xiangtan,37,小心跌下去爬不上来。,留神绊下去爬不起来,,niəɯ ʂən pan ɦɒ tɕˈie bɒ pu tɕˈi nai,niəɯ12 ʂən12 pan55 ɦɒ21 tɕˈie55 bɒ12 pu24 tɕˈi42 nai12,niəɯʂənpanɦɒtɕʰiebɒputɕʰinai,niəɯ12ʂən12pan55ɦɒ21tɕʰie55bɒ12pu24tɕʰi42nai12
XT,Xiangtan,38,医生叫你多睡睡。,医生要你多睏一下,,i siẽ iaɯ ȵi to kˈuan i ɦɒ,i33 siẽ33 iaɯ55 ȵi42 to33 kˈuan55 i24 ɦɒ21,isiẽiaɯɲitokʰuaniɦɒ,i33siẽ33iaɯ55ɲi42to33kʰuan55i24ɦɒ21
XT,Xiangtan,39,抽烟或者喝茶都不许。,吃烟或是吃茶都不准,,tɕˈiɒ iẽ ho ʂʅ tɕˈiɒ dzɒ təɯ pu tɕyn,tɕˈiɒ24 iẽ33 ho55 ʂʅ21 tɕˈiɒ24 dzɒ12 təɯ33 pu24 tɕyn42,tɕʰiɒiẽhoʂɻ̩tɕʰiɒdzɒtəɯputɕyn,tɕʰiɒ24iẽ33ho55ʂɻ̩21tɕʰiɒ24dzɒ12təɯ33pu24tɕyn42
XT,Xiangtan,40,烟也好，茶也好，我都不喜欢。,烟也好，茶也好，我都不喜欢,,iẽ iɒ haɯ dzo iɒ haɯ ŋo dəɯ pu ɕi hɔn,iẽ33 iɒ42 haɯ42 dzo12 iɒ42 haɯ42 ŋo42 dəɯ33 pu24 ɕi42 hɔn33,iẽiɒhaɯdzoiɒhaɯŋodəɯpuɕihɔn,iẽ33iɒ42haɯ42dzo12iɒ42haɯ42ŋo42dəɯ33pu24ɕi42hɔn33
XT,Xiangtan,41,不管你去不去，反正我是要去的。,不管你去不去，横直我是要去的,,pu kɔn ȵi tɕˈie pu tɕˈie ɸən tʂˈʅ ŋo ʂʅ iaɯ tɕˈie ti,pu24 kɔn42 ȵi42 tɕˈie55 pu24 tɕˈie55 ɸən12 tʂˈʅ55 ŋo42 ʂʅ21 iaɯ55 tɕˈie55 ti33,pukɔnɲitɕʰieputɕʰieɸəntʂʰɻ̩ŋoʂɻ̩iaɯtɕʰieti,pu24kɔn42ɲi42tɕʰie55pu24tɕʰie55ɸən12tʂʰɻ̩55ŋo42ʂɻ̩21iaɯ55tɕʰie55ti33
XT,Xiangtan,42,我非去不可。,我硬会要去,,ŋo ŋən ɸəi iaɯ tɕˈie,ŋo42 ŋən21 ɸəi21 iaɯ55 tɕˈie55,ŋoŋənɸəiiaɯtɕʰie,ŋo42ŋən21ɸəi21iaɯ55tɕʰie55
XT,Xiangtan,43,你是哪一年来的?,你是哪一年来的,,ȵi ʂʅ nɒ i ȵiẽ nai ti,ȵi42 ʂʅ21 nɒ42 i24 ȵiẽ nai33 ti33,ɲiʂɻ̩nɒiɲiẽnaiti,ɲi42ʂɻ̩21nɒ42i24ɲiẽnai33ti33
XT,Xiangtan,44,我是前年到的北京。,我是前介年到北京的,,ŋo ʂʅ dziẽ kɒ ȵiẽ taɯ pæ tɕin ti,ŋo42 ʂʅ21 dziẽ12 kɒ55 ȵiẽ12 taɯ55 pæ24 tɕin33 ti33,ŋoʂɻ̩dziẽkɒɲiẽtaɯpætɕinti,ŋo42ʂɻ̩21dziẽ12kɒ55ɲiẽ12taɯ55pæ24tɕin33ti33
XT,Xiangtan,45,今天开会谁的主席?,今日子开会哪个做主席,,tɕin i tsɿ kˈai ɸəi nɒ ko tsəɯ tɕy si,tɕin33 i24 tsɿ33 kˈai33 ɸəi21 nɒ42 ko55 tsəɯ55 tɕy42 si24,tɕinitsɹ̩kʰaiɸəinɒkotsəɯtɕysi,tɕin33i24tsɹ̩33kʰai33ɸəi21nɒ42ko55tsəɯ55tɕy42si24
XT,Xiangtan,46,你得请我的客。,你要请我做客㗑,,ȵi iaɯ tsˈin ŋo tsəɯ kˈæ pai,ȵi42 iaɯ55 tsˈin42 ŋo42 tsəɯ55 kˈæ24 pai55,ɲiiaɯtsʰinŋotsəɯkʰæpai,ɲi42iaɯ55tsʰin42ŋo42tsəɯ55kʰæ24pai55
XT,Xiangtan,47,一边走，一边讲。,边走边讲,,piẽ tsəɯ piẽ kɔn,piẽ33 tsəɯ42 piẽ33 kɔn42,piẽtsəɯpiẽkɔn,piẽ33tsəɯ42piẽ33kɔn42
XT,Xiangtan,48,越走越远，越说越多。,走越远，越讲越多,,yæ tsəɯ yæ yẽ yæ kɔn yæ to,yæ24 tsəɯ42 yæ24 yẽ42 yæ24 kɔn42 yæ24 to33,yætsəɯyæyẽyækɔnyæto,yæ24tsəɯ42yæ24yẽ42yæ24kɔn42yæ24to33
XT,Xiangtan,49,把那个东西拿给我。,把那隻东西拿把我,,pɒ nɒ tʂɒ tən si nɒ pɒ ŋo,pɒ42 nɒ24 tʂɒ24 tən33 si33 nɒ33 pɒ42 ŋo42,pɒnɒtʂɒtənsinɒpɒŋo,pɒ42nɒ24tʂɒ24tən33si33nɒ33pɒ42ŋo42
XT,Xiangtan,50,有些地方把太阳叫日头。,有的垱上叫太阳做日头,,iəɯ ti tɔn ʂɔn tɕiaɯ ian tsəɯ i dəɯ,iəɯ42 ti33 tɔn55 ʂɔn21 tɕiaɯ55 ian12 tsəɯ55 i24 dəɯ12,iəɯtitɔnʂɔntɕiaɯiantsəɯidəɯ,iəɯ42ti33tɔn55ʂɔn21tɕiaɯ55ian12tsəɯ55i24dəɯ12
XT,Xiangtan,51,您贵姓?我姓王。,你侬家贵姓?我姓王。,,n̩ nən kɒ kuəi sin ŋo sin uɔn,n̩42 nən42 kɒ33 kuəi55 sin55 ŋo42 sin55 uɔn12,n̩nənkɒkuəisinŋosinuɔn,n̩42nən42kɒ33kuəi55sin55ŋo42sin55uɔn12
XT,Xiangtan,52,你姓王我也姓王，咱们两个人都姓王。,你也姓王我也姓王，我人两个人都姓王,,ȵi iɒ sin uɔn ŋo iɒ sin uɔn ŋo in nian ko in təɯ sin uɔn,ȵi42 iɒ42 sin55 uɔn12 ŋo42 iɒ42 sin55 uɔn12 ŋo42 in12 nian42 ko55 in12 təɯ33 sin55 uɔn12,ɲiiɒsinuɔnŋoiɒsinuɔnŋoinniankointəɯsinuɔn,ɲi42iɒ42sin55uɔn12ŋo42iɒ42sin55uɔn12ŋo42in12nian42ko55in12təɯ33sin55uɔn12
XT,Xiangtan,53,你先去吧，我们等一会儿再去。,你先去啰，我人过一刻唧再去,,ȵi siẽ tɕˈie no ŋo in ko i kæ dʑi tsai tɕˈie,ȵi42 siẽ33 tɕˈie55 no21 ŋo42 in12 ko55 i24 kæ24 dʑi21 tsai55 tɕˈie55,ɲisiẽtɕʰienoŋoinkoikædʑitsaitɕʰie,ɲi42siẽ33tɕʰie55no21ŋo42in12ko55i24kæ24dʑi21tsai55tɕʰie55
XT,Xiangtan,54,你抽烟不抽?/你抽不抽烟?,你吃烟不,,ȵi tɕˈiɒ iẽ pu,ȵi42 tɕˈiɒ24 iẽ33 pu24,ɲitɕʰiɒiẽpu,ɲi42tɕʰiɒ24iẽ33pu24
XT,Xiangtan,55,你认得那个人不认得?,你认得那个人不认得,,ȵi in tæ nɒ tʂɒ in pu,ȵi42 in21 tæ24 nɒ24 tʂɒ24 in12 pu24,ɲiintænɒtʂɒinpu,ɲi42in21tæ24nɒ24tʂɒ24in12pu24
